Review_id,Ratings,Dates,Date_Category,Heads,Texts,Flavor,Sweet,Lasting
1,5.0,2 days,Less than 2 months,This is my favorite one. It last longer.,The best flavor I’ve tried. And it’s cheaper online Than buying it in store,5.0,5.0,5.0
2,5.0,3 days,Less than 2 months,Cherub Vapes,I love them,5.0,5.0,5.0
3,5.0,6 days,Less than 2 months,Peach ice,Great flavor and lasts long,5.0,5.0,5.0
4,5.0,6 days,Less than 2 months,Bomb.com,So quick with shipment and the best prices out there hands down. This was my first order and I will ordering again and again and again. Def my go to spot moving forward.,5.0,3.0,5.0
5,5.0,8 days,Less than 2 months,Best brand Topshine,I’d strongly recommend peach flavor,5.0,5.0,5.0
6,5.0,12 days,Less than 2 months,Yurrrr,The best,5.0,5.0,4.0
7,5.0,13 days,Less than 2 months,Great,It is cool ! Love the taste an long lasting,5.0,5.0,5.0
8,5.0,19 days,Less than 2 months,Great products,Love it . Will recommend. Placing new order ASAP,5.0,5.0,5.0
9,5.0,20 days,Less than 2 months,Great,"Great flavor, long lasting.",5.0,5.0,4.0
10,4.0,20 days,Less than 2 months,Good,The taste was amazing it just didn't last as long as I personally would have thought but great taste,5.0,5.0,4.0
11,5.0,22 days,Less than 2 months,"Great flavor, long lasting, stylish design",Great vape. I'm really glad i tried it. The cola flavor reminded me of the slushees i drank as a kid.,5.0,5.0,4.0
12,5.0,22 days,Less than 2 months,Nice rich flavor,Awesome vape...long lasting...great price,5.0,5.0,5.0
13,5.0,22 days,Less than 2 months,Traci,I really enjoy this flavor.,5.0,5.0,5.0
14,5.0,23 days,Less than 2 months,Love it,Best,5.0,5.0,5.0
15,5.0,23 days,Less than 2 months,Best,Love it,5.0,5.0,5.0
16,5.0,23 days,Less than 2 months,Love it,Best vape,5.0,5.0,5.0
17,5.0,23 days,Less than 2 months,Best vape,Love it,5.0,5.0,5.0
18,5.0,23 days,Less than 2 months,Best vape,Love it,5.0,5.0,5.0
19,5.0,23 days,Less than 2 months,Best vape,Love it,5.0,5.0,5.0
20,5.0,23 days,Less than 2 months,Best vape,Love it,5.0,5.0,5.0
21,5.0,23 days,Less than 2 months,Best vape,Love it,5.0,5.0,5.0
22,5.0,24 days,Less than 2 months,Good,Good,5.0,5.0,5.0
23,5.0,26 days,Less than 2 months,👍,I love the top shine brand,5.0,5.0,5.0
24,1.0,28 days,Less than 2 months,It does not taste like grape.,"Flavor is off, mint was good.",3.0,2.0,3.0
25,5.0,1 month,Less than 2 months,Unexpected,Good flavor,5.0,3.0,3.0
26,5.0,1 month,Less than 2 months,These are great,The flavors are great the price is the best and shipping was so fast. I am definitely only ordering from here for now on.,5.0,4.0,5.0
27,4.0,1 month,Less than 2 months,Great overall,"I ordered in bulk, so far one of them tasted already burnt so we tossed it out. Over all satisfied with products though and will order again.",5.0,5.0,5.0
28,5.0,1 month,Less than 2 months,Super,Really good flavor and good battery I will buy it again.,5.0,5.0,4.0
29,5.0,1 month,Less than 2 months,Top Shine,This is the best flavor.,4.0,4.0,3.0
30,4.0,1 month,Less than 2 months,TopShine Review,Great product to replace JUUL and like the flavors!,4.0,4.0,4.0
31,5.0,1 month,Less than 2 months,Super menthol,"Super icy menthol, which I love",5.0,5.0,3.0
32,5.0,2 months,Less than 2 months,Review for Huff and Puffer,I love this product! Thank you!,5.0,4.0,4.0
33,5.0,2 months,Less than 2 months,Thank you,Like very much thank you,4.0,4.0,4.0
34,5.0,2 months,Less than 2 months,Always my go to vape,I love how flavorful and refreshing this brand is. After vaping with this brand I haven't found anything that comes close to compare. :),5.0,5.0,4.0
35,5.0,2 months,Less than 2 months,Top shine,Love them,5.0,3.0,5.0
36,5.0,2 months,Less than 2 months,Top Shine is in my top five,"Good flavor, long lasting",5.0,4.0,5.0
37,5.0,2 months,Less than 2 months,Good Product's,i like the products,5.0,4.0,3.0
38,5.0,2 months,Less than 2 months,great product!,amazing flavor and lasts a while!!,5.0,4.0,5.0
39,5.0,2 months,Less than 2 months,Taste,Enjoy the flavor,5.0,5.0,5.0
40,5.0,2 months,Less than 2 months,Great!,"Great customer service, and arrives quickly 😊",5.0,5.0,5.0
41,3.0,2 months,Less than 2 months,Good,Tasted good wish it had more of a strawberries taste,3.0,5.0,4.0
42,5.0,3 months,3 months to 5 months ago,Perfect,Not too sweet n last a while!,5.0,3.0,4.0
43,5.0,3 months,3 months to 5 months ago,Top choice,Great pull. Flavor is great,5.0,5.0,5.0
44,5.0,3 months,3 months to 5 months ago,fav blueberry lemonade,on the sweeter end of other blueberry lemonades but fits my taste,5.0,5.0,4.0
45,5.0,3 months,3 months to 5 months ago,Awesome,"Good flavors, no leaks and lasted long",4.0,3.0,4.0
46,4.0,3 months,3 months to 5 months ago,Design on the mouth piece,Dislike the mouth piece design,3.0,4.0,3.0
47,5.0,3 months,3 months to 5 months ago,Marcos/Silvia,Good but doesn’t last long,5.0,3.0,3.0
48,4.0,3 months,3 months to 5 months ago,Top Shine Cherub Disposable Vape 5% Nicotine,I like the flavor taste and sweetness. The problem with top shine is the long lasting part. Some of them last a long time and some of them just after 2 days the taste burnt already. They are not consistent with the quantity of the liquid in the product.,5.0,5.0,3.0
49,5.0,3 months,3 months to 5 months ago,Great taste!,Really good taste and lasts a while.,5.0,5.0,5.0
50,5.0,3 months,3 months to 5 months ago,Best Vape,"Great vape, smooth and last awhile!",5.0,5.0,5.0
51,5.0,3 months,3 months to 5 months ago,Amazing!!,"Great vape, smooth and last awhile!",5.0,5.0,5.0
52,5.0,3 months,3 months to 5 months ago,Good vape,"Great vape, smooth and last awhile!",5.0,5.0,5.0
53,5.0,3 months,3 months to 5 months ago,vape review,great taste and rechargeable,5.0,4.0,2.0
54,5.0,3 months,3 months to 5 months ago,Good,Love the flavor,5.0,5.0,5.0
55,5.0,3 months,3 months to 5 months ago,Favorite,Strawberry watermelon is my favorite the disposable lasted a pretty long time for as much as I puff. I recommend,4.0,4.0,4.0
56,1.0,3 months,3 months to 5 months ago,Love the products just not this flavor,Don’t care for the taste,2.0,3.0,3.0
57,5.0,3 months,3 months to 5 months ago,TOP SHINE FOR THE WIN,"suprisingly lost quite a long time and the flavor is really good, highly recommend the guava ice",5.0,4.0,5.0
58,5.0,3 months,3 months to 5 months ago,Quick delivery,Good taste,5.0,5.0,5.0
59,5.0,3 months,3 months to 5 months ago,Comfortable,Great flavor and sleek fit,4.0,4.0,4.0
60,5.0,3 months,3 months to 5 months ago,Taste good,Taste good long lasting,5.0,5.0,5.0
61,3.0,4 months,3 months to 5 months ago,Alright,Tasted good till the charge,4.0,3.0,2.0
62,5.0,4 months,3 months to 5 months ago,GRAPE ICE,oh this is what you call a nice hit something that will hit like a cig but way better,5.0,5.0,5.0
63,5.0,4 months,3 months to 5 months ago,Fantastic,Guava Ice is my go to flavor,4.0,3.0,4.0
64,5.0,4 months,3 months to 5 months ago,Great flavor,"Love this brand. They last long, have good flavor and I like the fact they recharge",5.0,5.0,5.0
65,5.0,4 months,3 months to 5 months ago,Smooth hit and sweet taste,Smooth hit and sweet taste,5.0,5.0,5.0
66,5.0,4 months,3 months to 5 months ago,Good,aloe grape has icedddd,5.0,5.0,4.0
67,5.0,4 months,3 months to 5 months ago,Best vape,Aloe grape best flavor !,4.0,3.0,5.0
68,5.0,4 months,3 months to 5 months ago,Blueberry lemon,Really nice and subtle flavor which was spot on to a blueberry lemonade!,5.0,5.0,5.0
69,4.0,4 months,3 months to 5 months ago,Great taste,Long lasting and great taste,5.0,4.0,4.0
70,5.0,4 months,3 months to 5 months ago,Rechargeable Peach Ice.,I really like the peach ice flavor. It's sweet and refreshing. This disposable is rechargeable. It seems to last longer and give you more per puff. These are our new favorite disposables.,5.0,5.0,5.0
71,5.0,4 months,3 months to 5 months ago,"Great, consistent flavor","Really enjoy most flavors. The ice are ""cooler"" than the others. They last longer than most. Since this brand isn't available in AZ, Huff & Puffers is my go to for best variety and price!",4.0,5.0,5.0
72,5.0,4 months,3 months to 5 months ago,Peach ice,Really a great vape. Flavor is amazing. Just wish I didn't have to order by mail,5.0,5.0,4.0
73,5.0,4 months,3 months to 5 months ago,Still a favorite,"We keep coming back to the Top Shine Cherub even after trying others. The flavor is rich and smooth, without having a chemical or metallic after-taste. It was recommended to us to only charge these pens for 10-20 minutes at a time because if they are allowed to fully charge, the flavor ends up with a burnt taste due to the intensity of the vaporizer.",5.0,5.0,5.0
74,5.0,4 months,3 months to 5 months ago,Nice flavor,Nice flavor,4.0,2.0,2.0
75,5.0,4 months,3 months to 5 months ago,Great,Perfect,5.0,5.0,5.0
76,5.0,4 months,3 months to 5 months ago,my favorite,the taste is amazing,5.0,5.0,5.0
77,5.0,4 months,3 months to 5 months ago,Lychee Ice,Best lychee flavor i've tried !!! I don't really like the look of these though but the flavor is so good,5.0,4.0,5.0
78,5.0,4 months,3 months to 5 months ago,Sweet,Delicious,5.0,5.0,5.0
79,5.0,4 months,3 months to 5 months ago,Sweet,Delicious,5.0,5.0,5.0
80,5.0,4 months,3 months to 5 months ago,Loved it.,"The first few hits the taste is strong, but after that I lived the grape taste. I want more :)",5.0,5.0,5.0
81,5.0,4 months,3 months to 5 months ago,Fast and good!,"Super fast delivery in CA, and top quality product!",5.0,4.0,5.0
82,5.0,4 months,3 months to 5 months ago,Great flavor,Great flavor and smooth vape,5.0,5.0,5.0
83,5.0,5 months,5 months to 1 year ago,Aloe Grape,"This is actually a really good brand. Tried it randomly, and was pleasantly surprised! The flavor is amazing and very potent . It also lasted a long time!",5.0,5.0,5.0
84,5.0,5 months,5 months to 1 year ago,So goooddd,Delicious!!,5.0,5.0,5.0
85,5.0,5 months,5 months to 1 year ago,The ice pop up!,Very icy,5.0,4.0,4.0
86,5.0,5 months,5 months to 1 year ago,Harsh but flavorful,It definitely gives you the buzz you’re looking for but flavor isn’t compromised :),5.0,3.0,5.0
87,3.0,5 months,5 months to 1 year ago,Smooth,"I like them, the flavor is nice but sometimes the liquid would come out as you puffed it and get in your mouth.",5.0,4.0,4.0
88,5.0,5 months,5 months to 1 year ago,Really nice,Hits hard and rechargeable which is a plus,5.0,5.0,5.0
89,5.0,5 months,5 months to 1 year ago,Good,👍,5.0,5.0,5.0
90,5.0,5 months,5 months to 1 year ago,Great Product!,"Never had any issues with any top shine, and went through multiples!",5.0,5.0,5.0
91,5.0,5 months,5 months to 1 year ago,Can't go wrong,"Can't go wrong, never had any top shine that wasn't up to par.",5.0,5.0,5.0
92,5.0,5 months,5 months to 1 year ago,GREAT,Loved it,5.0,5.0,5.0
93,4.0,5 months,5 months to 1 year ago,Great!,"Great tasting, long lasting vape! Would recommend.",5.0,4.0,5.0
94,5.0,5 months,5 months to 1 year ago,Great Vape,"Great flavor, last long, doesn’t taste burnt after hitting it multiple times.",5.0,4.0,4.0
95,4.0,5 months,5 months to 1 year ago,Lasts a good while,I think I got this in grape and it was decent,,,
96,4.0,5 months,5 months to 1 year ago,Great product,Flavor lasted till the end of product,,,
97,4.0,5 months,5 months to 1 year ago,Flavor stays but burned out quicker than others,Solid,,,
98,5.0,5 months,5 months to 1 year ago,it's OK,it's OK,,,
99,5.0,5 months,5 months to 1 year ago,Surprisingly good,"I'm reluctant to try new brands these days as I've gotten so many duds that way. I passed over this brand for some time but I'm pleasantly surprised by Top Shine. I purchased the Lychee flavored vape and I will definitely try it again. This vape has a smooth texture, very bold flavor, even for lychee which is often subtle. It tastes juicy and more like the real fruit, not artificial or candy like, and no after taste. No real complaints here.",,,
100,4.0,5 months,5 months to 1 year ago,Tastes good but the taste will fade very quickly,I like this product but I think the taste fades very quickly.,,,
101,5.0,5 months,5 months to 1 year ago,Banana ice,Probably one of the best banana ice I’ve had,,,
102,5.0,5 months,5 months to 1 year ago,Peach ice,I love the peach ice. It has the best flavor and it lasts me about two weeks. It’s the best brand I’ve tried so far,,,
103,5.0,6 months,5 months to 1 year ago,Chubby Cherub….,This is the first vape I ever tried and I have loved them ever since. An amazing product.,,,
104,5.0,6 months,5 months to 1 year ago,Long lasting,This brand is very flavorful if that’s your preference. This brand actually lasts as advertised.,,,
105,5.0,6 months,5 months to 1 year ago,Strawberry Watermelon,This Vape is very good comparing to all the ones I have bought. Long lasting taste and it last very very long. A+++++++++++,,,
106,5.0,6 months,5 months to 1 year ago,Flavorful,"This is my girlfriend's favorite brand and I can see why. The flavors are rich and are not as basic as the other disposables. You can tell the company invests a lot of research into getting the flavors right. There hasn't been a flavor that I didn't like! They last long and are rechargeable with USB-C. They die an awful death though, meaning the burnt flavor comes out of nowhere when they are about to die. Will probably order more once we are done trying everything else :)",,,
107,5.0,6 months,5 months to 1 year ago,Smooth vape,"If you love menthol, this is the one!",,,
108,5.0,6 months,5 months to 1 year ago,One of the best Disposables,"These are one of the best disposables! Good flavor, no spit back, and lasts a long time (over a week). Key is not to charge the battery all the way so the coil doesn't burn. Down sides are the USB-C connector for charging and the blue light can be too bright at night.",,,
109,5.0,6 months,5 months to 1 year ago,Dependable rechargeable consistent,Love the grape ice and guava ice flavors,,,
110,5.0,6 months,5 months to 1 year ago,Good,Good,,,
111,5.0,6 months,5 months to 1 year ago,Flavorfull,Very tasty,,,
112,5.0,6 months,5 months to 1 year ago,Review,"Nice flavor, lasts long",,,
113,5.0,6 months,5 months to 1 year ago,Great flavor,This is one of my best disposable vapes,,,
114,5.0,6 months,5 months to 1 year ago,Love it,Smooth and nice flavors. Recommended to try it,,,
115,5.0,6 months,5 months to 1 year ago,2 Thumbs Up,Top Shine tastes good and lasts long. Quick to charge as well. Lasts me 2 to 3 charges before the flavor is completely gone.,,,
116,5.0,7 months,5 months to 1 year ago,Really good,Pulls easy and a very nice grape flavor,,,
117,5.0,7 months,5 months to 1 year ago,"Probably My Favorite, Blueberry-Lemon","Have tried a few disposables now and have to say, this one lasts a really long time and I love the flavor. Can taste both the blueberry and the lemon. Has a good draw; I do not care for ones that make huge puffs of vapor. This one is perfect, at least for me anyway! Will purchase this brand again for sure!",,,
118,5.0,7 months,5 months to 1 year ago,Always great quality!,Flavor was amazing! Lasted long and tasted pretty realistic,,,
119,5.0,7 months,5 months to 1 year ago,Love banana & aloe grape!,"These have good flavor and lots of juice. No issues with battery life, would buy again.",,,
120,5.0,7 months,5 months to 1 year ago,Very good brand,Very good brand,,,
121,5.0,7 months,5 months to 1 year ago,👍,Good flavor,,,
122,5.0,7 months,5 months to 1 year ago,Good,Goodp,,,
123,5.0,7 months,5 months to 1 year ago,Good flavor,Good rechargeable device,,,
124,5.0,8 months,5 months to 1 year ago,❤️❤️❤️,I Love this vape!!’,,,
125,5.0,8 months,5 months to 1 year ago,Yes,None juicier,,,
126,5.0,8 months,5 months to 1 year ago,Greaaaat!,"Love Top Shine, really gives you nice clouds and great flavor. Lasts longer than most vapes and it’s rechargeable!",,,
127,3.0,8 months,5 months to 1 year ago,It’s ok,The taste wasn’t for me although I liked the puff. It burned out pretty quickly,,,
128,5.0,8 months,5 months to 1 year ago,Smooth,Smooth and not harsh like other disposables,,,
129,5.0,8 months,5 months to 1 year ago,Great,Long lasting flavor!!!,,,
130,4.0,8 months,5 months to 1 year ago,Top shine,Good flavor. Didn't last that long,,,
131,5.0,8 months,5 months to 1 year ago,👌🏼,"Worked well, friendly service!",,,
132,5.0,8 months,5 months to 1 year ago,⭐️✨⭐️,Very goooood 👍,,,
133,4.0,8 months,5 months to 1 year ago,VAPPER,Good,,,
134,5.0,9 months,5 months to 1 year ago,Top shine,"Awesome taste ! Love the ICE ! And it’s rechargeable, lasts me about 3 weeks",,,
135,3.0,9 months,5 months to 1 year ago,ESTA MASOMENOS,ESTA BIEN PERO SE ACAVA MUY PRONTO 👍,,,
136,5.0,9 months,5 months to 1 year ago,Good juice,I love the vape good taste,,,
137,4.0,9 months,5 months to 1 year ago,Decent price and decent flavor,"I won’t say it’s the best vape, but for the price and decent flavor it’s ok",,,
138,5.0,9 months,5 months to 1 year ago,New go to disposable vape,Good,,,
139,5.0,9 months,5 months to 1 year ago,Amazing flavor,This brand definitely gives you a great head high and the flavor is great. It lasted me about two weeks,,,
140,5.0,9 months,5 months to 1 year ago,Topshine,My fav vale out of all of em,,,
141,5.0,9 months,5 months to 1 year ago,!!,The BEST and probably strongest guava flavor I’ve tried. Super menthol too and really smooth. It lasted a really long time before it blink for me to charge it!,,,
142,5.0,9 months,5 months to 1 year ago,Great vape lots of flavor,I liked that it gives me the feeling of a cigarette. That helps if you want to quit smoking cigarettes.,,,
143,4.0,9 months,5 months to 1 year ago,Plain and simple,Straightforward mango. A bit sweet and light on the ice. Good battery life. Something to return to.,,,
144,5.0,9 months,5 months to 1 year ago,Guava luver,"Flavor on point. Long battery life. A tad bit on the sweet side, but definitely something to keep handy. Can't go wrong",,,
145,5.0,10 months,5 months to 1 year ago,Great Vape,This one is my fav so far.,,,
146,4.0,10 months,5 months to 1 year ago,Good vape!,Like topshine grape ice one of the favs in the group for them.,,,
147,4.0,10 months,5 months to 1 year ago,great but too sweet,great taste but kind of too sweet for me.,,,
148,5.0,10 months,5 months to 1 year ago,Top Shine Cherub Grape Ice,"This is the best grape flavor I have purchased. It reminds me of the Big League Chew Grape flavor bubblegum. If you’re in the market for a grape flavored vape, this is the one!!",,,
149,5.0,10 months,5 months to 1 year ago,Top notch flavor,Recently got into disposable and this was better than most that I've had.,,,
150,5.0,10 months,5 months to 1 year ago,Great,"Moving on to these from flums, best choice yet!",,,
151,5.0,10 months,5 months to 1 year ago,Great Device,It’s got a great flavor and does not need much of a charge which is great,,,
152,5.0,11 months,5 months to 1 year ago,Excellent!,Great flavor not super minty like the Daze egg and super long lasting.,,,
