Review_id,Ratings,Dates,Date_Category,Heads,Texts,Flavor,Sweet,Lasting
367,5.0,5 months,5 months to 1 year ago,Always great and great customer service,Can't say enough about this company. Always great and on time cheapest vapes that I can find. I always order over 150.xx dollars worth and this company I can't say enough good things about them,,,
368,5.0,5 months,5 months to 1 year ago,Good flavor,I do like this flavor I only had one that would not work out of 14,,,
369,5.0,5 months,5 months to 1 year ago,Love the flavor and how long it lasts,"Love the Strawberry Sky and Mango Mochi. Great product and consistently good. Also, Huff and Puffers has the best customer service and incredibly fast shipping!",,,
370,5.0,5 months,5 months to 1 year ago,Very good,Good,,,
371,5.0,5 months,5 months to 1 year ago,Max flow,Love it!,,,
372,5.0,5 months,5 months to 1 year ago,Love it n it lasts forever,It’s light n perfect,,,
373,2.0,6 months,5 months to 1 year ago,Taste not the best,Taste like chemical,,,
374,4.0,6 months,5 months to 1 year ago,Short lived,Good but doesn’t last long,,,
375,5.0,6 months,5 months to 1 year ago,best,best,,,
376,5.0,6 months,5 months to 1 year ago,Hype Max cucumber berry,Great convenient little disposable,,,
377,4.0,6 months,5 months to 1 year ago,Great taste,"Pineapple flowmax is one of my favorite flavors ,",,,
378,5.0,6 months,5 months to 1 year ago,Favorite,"I have started purchasing these and I love how fast my order is filled and recieved
All the flavors I like are always in stock and cheaper than my local store",,,
379,5.0,6 months,5 months to 1 year ago,Good product,Very nice!,,,
380,5.0,6 months,5 months to 1 year ago,Pretty!,"Lasted a while for me, convient and good flavor! Will buy more!",,,
381,5.0,6 months,5 months to 1 year ago,Hyppe it up!,These are great vapes. Love them.,,,
382,5.0,6 months,5 months to 1 year ago,Favorite,These are my favorite,,,
383,5.0,6 months,5 months to 1 year ago,great flavor,awesome flavor -- lasts a long time. amazing price for what you are receiving plus FAST shipping is a huge bonus,,,
384,1.0,6 months,5 months to 1 year ago,Product sucks!,Love the flavor but the product sucks! They only last a day or two before the battery dies. I will never use this product again.,,,
385,5.0,6 months,5 months to 1 year ago,Cola is the best flavor!,"I like it. A little too much. It’s too hard to quit. Taste is great and leaves me feeling good,",,,
386,5.0,6 months,5 months to 1 year ago,It’s really smooth n great taste vape i ever tasted,It’s wonderful n I really love it,,,
387,5.0,6 months,5 months to 1 year ago,Great disposal vape,"I quit smoking using the disposable vipes and found this one I really like. It's the only one I use and lasts approximately 3days. Very convenient, no mess easy vaping.",,,
388,5.0,6 months,5 months to 1 year ago,Nice taste,The flow on this one and flavor was surprisingly better than expected,,,
389,5.0,6 months,5 months to 1 year ago,Review,Long lasting,,,
390,5.0,6 months,5 months to 1 year ago,Pineapple,Great,,,
391,5.0,6 months,5 months to 1 year ago,Hyppe max flow,It was good,,,
392,5.0,6 months,5 months to 1 year ago,Current favorite,"Like the flavor. Sometimes a bit too menthol, I don’t mind though.",,,
393,5.0,6 months,5 months to 1 year ago,Yummy,It’s yummy,,,
394,5.0,6 months,5 months to 1 year ago,Smoking,I have not had a cigarette in 5 weeks!,,,
395,5.0,6 months,5 months to 1 year ago,Love these,Great flavor,,,
396,5.0,6 months,5 months to 1 year ago,Hyppe Max flow Supreme,Good product,,,
397,5.0,6 months,5 months to 1 year ago,Nice little pen,"I am pretty impressed with these. Most of the flavors are pretty tasty. I wish they lasted a bit longer but for a disposable, I really like them!",,,
398,4.0,6 months,5 months to 1 year ago,90% of what I want,"Good, adjustable flow, long battery and accurate amount of puffs. Just some flavors are meh and received a dud once. Huff and Puffers gave me store credit however and they're cheaper than competitors! Love them",,,
399,5.0,6 months,5 months to 1 year ago,Hype Max Flow Supreme,Good flavors and last decent amount of time.,,,
400,5.0,6 months,5 months to 1 year ago,Love the flavor,Banana freeze tastes axactly like a banana laffy taffy,,,
401,4.0,6 months,5 months to 1 year ago,Peachy,"I love the Hyppe Max Flow Supreme Disposable Vape in Peach Freeze flavor! There is an occasional vape or two in my orders that tastes spoiled and have to sadly throw away after a couple puffs, but haven’t got the chance to try and get a replacement (if that’s even possible). Regardless, I like this brand and flavor—has helped me tremendously from going back to cigarettes :)",,,
402,5.0,6 months,5 months to 1 year ago,Hyppe,I like the taste. Sometimes it does not seem to last very long,,,
403,5.0,6 months,5 months to 1 year ago,Smooth,"Very satisfying, probably my favorite.",,,
404,5.0,6 months,5 months to 1 year ago,Great Flavor,Love these vapes. They are long lasting and have great flavor.,,,
405,5.0,6 months,5 months to 1 year ago,lew waltman,good taste for all you ex smokers,,,
406,5.0,6 months,5 months to 1 year ago,Max Flow Vapes - Great Price and fast delivery,I always order from Huff & Puffers the prices are giid and their selection is outstanding.,,,
407,5.0,6 months,5 months to 1 year ago,Hyppe Max Flow Supreme Disposable Vape 5% Nicotine,"I am happy with this vape. It doesn't last as long as I had hoped, but it is very satifying.",,,
408,5.0,6 months,5 months to 1 year ago,Great,Love these perfect hitting and lasts a long time,,,
409,5.0,6 months,5 months to 1 year ago,Bob,Great,,,
410,5.0,6 months,5 months to 1 year ago,Awesome deal!,"Loved the flavor, arrived quickly, and had no issues. Very happy!",,,
411,5.0,6 months,5 months to 1 year ago,Best one,I love it,,,
412,5.0,6 months,5 months to 1 year ago,Last long,Great product,,,
413,5.0,6 months,5 months to 1 year ago,Worth ordering,"Fast shipping, good price",,,
414,5.0,6 months,5 months to 1 year ago,Hype max flow,I like them very much,,,
415,5.0,6 months,5 months to 1 year ago,My daily Vapes.,This is the only vape I use. Hits smoother than other brands. Air flow to adjust.,,,
416,5.0,6 months,5 months to 1 year ago,Mr,Great flavor,,,
417,5.0,6 months,5 months to 1 year ago,Love it,I bought it several times and I think it’s the best!,,,
418,4.0,6 months,5 months to 1 year ago,Battery sadness,"I love the flavor, love the 2 day shipping but when I use this vape it tends to die out too soon....I wish they'd make the mighty mint rechargeable like the nunu disposable edition. Still love the flavor and the brand",,,
419,5.0,6 months,5 months to 1 year ago,My Favorite,Best disposable vape I've found.,,,
420,5.0,6 months,5 months to 1 year ago,New go to,Good flavor and the adjustable airflow is nice.,,,
421,5.0,6 months,5 months to 1 year ago,Good stuff,Great flavor,,,
422,5.0,6 months,5 months to 1 year ago,Love it!,i enjoyed that flavor and specially huff and puffers prices!,,,
423,5.0,6 months,5 months to 1 year ago,It's good,Good flavors but they die quickly,,,
424,4.0,6 months,5 months to 1 year ago,Great flavor,"Great flavor
But theres a little bit of menthol that i dont like",,,
425,4.0,6 months,5 months to 1 year ago,Hype max flow,Good airflow!,,,
426,5.0,7 months,5 months to 1 year ago,Hyppe Max Flow Supreme Disposable Vape 5% Nicotine,really like the flavor,,,
427,3.0,7 months,5 months to 1 year ago,Taste good,The flavor is ok. kind of dry,,,
428,5.0,7 months,5 months to 1 year ago,"Great product, great price","Great product, great price & great customer service",,,
429,5.0,7 months,5 months to 1 year ago,Hyppe Max Flow,Good flavor,,,
430,5.0,7 months,5 months to 1 year ago,"Great taste, long lasting",Excellent product and I would highly recommended. It lasts a long time.,,,
431,5.0,7 months,5 months to 1 year ago,Yummy,My favorite,,,
432,4.0,7 months,5 months to 1 year ago,Very good,always a go to,,,
433,5.0,8 months,5 months to 1 year ago,Amazing,Love this one,,,
434,5.0,8 months,5 months to 1 year ago,Excellent!,"Great service, fast shipping, and fair price.",,,
435,5.0,8 months,5 months to 1 year ago,This Shop 👌,"they have it all, are super friendly, and definitely one of the nicest shops i’ve seen",,,
436,5.0,8 months,5 months to 1 year ago,Recommend,Good flavor. Pen lasts a while,,,
437,5.0,8 months,5 months to 1 year ago,I love these!,"These disposable vapes are awesome!! The flavors are very on point. Also, the customer service at Huff and puffers is excellent.",,,
438,5.0,8 months,5 months to 1 year ago,Great,Flavorful and last for along time,,,
439,5.0,8 months,5 months to 1 year ago,Love it,Great taste,,,
440,5.0,8 months,5 months to 1 year ago,Love it,Great taste,,,
441,5.0,8 months,5 months to 1 year ago,Hyppe Max Flow Supreme,Good flavor and smooth vape.,,,
442,5.0,8 months,5 months to 1 year ago,Hyppe max flow,Perfect,,,
443,5.0,8 months,5 months to 1 year ago,Easy and simple,Don’t need device charge and smoke easy.,,,
444,5.0,9 months,5 months to 1 year ago,Good Vape,"I always come to Huff & Puffers and my opinion on the hype Max flow ones is that they last a good amount of time. Have a good flow and the flavors last till they go out, I haven't had any burnt ones, they are such good quality and that's why I always buy the hype Max flow vapes, thank you",,,
445,5.0,9 months,5 months to 1 year ago,👌,👍🏻,,,
446,5.0,9 months,5 months to 1 year ago,Lifer!,"I love the Hyppe, I actually quite smoking cigarettes a few months ago, these have helped me! The price, flavors, and customer service is 💯",,,
447,5.0,9 months,5 months to 1 year ago,I love it!,Excellent the taste is so good I really recommend 👍🏻,,,
448,5.0,9 months,5 months to 1 year ago,Maxx flo,Great product,,,
449,5.0,9 months,5 months to 1 year ago,Steady quality,"Can’t complain on the quality of flavors, I like the adjustable airflow, they last a good amount for the price. Flavors are always great quality in comparison with other companies I’ve tried. Flum a small hyper bar are always too contenders. I’ve tried other companies especially recently, taking advantage of deals, but can’t go wrong with these two companies.",,,
450,4.0,9 months,5 months to 1 year ago,amazing product,flavor is on point,,,
451,5.0,9 months,5 months to 1 year ago,All day,Everyday,,,
452,5.0,9 months,5 months to 1 year ago,This is one of the items I get every time,It is just like how I want if I want something fruity. I get this with might mint smoke both at the same time :),,,
453,5.0,9 months,5 months to 1 year ago,One of the best ones,One of the good ones I bought so far,,,
454,5.0,9 months,5 months to 1 year ago,One of the best ones,I always am open to try new flavors and this is one the best ones I have tried,,,
455,5.0,9 months,5 months to 1 year ago,Vape,Its good,,,
456,5.0,10 months,5 months to 1 year ago,Hyppe max flow,I love the icey flavors the most. My favorite is the guava ice. I wish they had more flavors with ice. I’ve bought the non ice ones and they just don’t give me that rush like the ice ones do. Still my favorite place to go to buy a vape.,,,
457,5.0,10 months,5 months to 1 year ago,Best disposable,Awesome product,,,
458,5.0,10 months,5 months to 1 year ago,Naked,Nice!!,,,
459,5.0,10 months,5 months to 1 year ago,Hyppe Max Flow is the best disposables I've used.,"Hyppe Max Flow is the best disposables I've used. Taste doesn't change after time, good amount of puffs and slick design.",,,
460,5.0,10 months,5 months to 1 year ago,Good,Good,,,
461,5.0,10 months,5 months to 1 year ago,Cola freeze vape,this is smoother and has more cola flavor than 2 other brands I tried.,,,
462,5.0,11 months,5 months to 1 year ago,satisfied,good alternative to smoking,,,
463,5.0,11 months,5 months to 1 year ago,Solid,Great taste,,,
464,5.0,11 months,5 months to 1 year ago,great flavors!,"Recently tried this brand, and really enjoyed the new flavors!",,,
465,5.0,11 months,5 months to 1 year ago,Mojito berry,Very minty with a hint of berry. Hit very smooth one of my favorite,,,
466,5.0,11 months,5 months to 1 year ago,Worth every penny!,I love all the flavors they have!!!,,,
467,5.0,11 months,5 months to 1 year ago,Hyppe has really upped their game,"I love the flavors hyppe created and I used to buy the original, smaller hyppe bars in bulk but the flavor and time they would last would be very inconsistent between each. Their max flow supremes fixed both problems. Now I buy with confidence everytime. try them yourself and see. I love the mint flavor but it also has a nice cooling effect too even tho it doesn’t have “ice“ in its name.",,,
468,5.0,11 months,5 months to 1 year ago,Great product,Love Cucumber Berry. My fave!! Next day delivery!! Love it!,,,
469,5.0,11 months,5 months to 1 year ago,Very good,Good,,,
470,5.0,11 months,5 months to 1 year ago,very satisfied,"im so satisfied i didnt get any defects on my orders yet, hopefully not and they deliver it pretty fast now. and the price is good! will buy and again and definitely recommend it!",,,
471,5.0,11 months,5 months to 1 year ago,Nice!,Good stuff. Good price. Lasts long.,,,
472,5.0,11 months,5 months to 1 year ago,So smooth and tasty,I love this product so much,,,
473,5.0,11 months,5 months to 1 year ago,Superb,Really enjoyed it,,,
474,5.0,11 months,5 months to 1 year ago,Great product.,This is very yummy vape flavor.,,,
475,5.0,11 months,5 months to 1 year ago,love this flavor,lots of verity and this brand is a must,,,
476,5.0,11 months,5 months to 1 year ago,good vape,very good flavor,,,
477,5.0,11 months,5 months to 1 year ago,STRAWNERRY SKY,yes. this is a good flavor. u have to smoke it for a minute for it to grow on u cuz the flavor kinda comes off p strong when u first try it but.. I LIKE IT MAN. it took me a minute but ye... it was p good. yep. recommend. yep,,,
478,3.0,11 months,5 months to 1 year ago,max flow.,i like the strawberry sky one more. now THAT ONE IS LIT. get that instead of this. this is ... watevers man. yep.,,,
479,3.0,11 months,5 months to 1 year ago,uhh..,this flavor.. i dont remember the flavor but i like the smokes.. my o's be kinda fiyah with max flows.. RECCOMEND. yep.,,,
480,4.0,11 months,5 months to 1 year ago,Strawberry milk,"Flavor is pretty good, if you like strawberry milk I would recommend this flavor. These disposable surprisingly last long too",,,
481,4.0,12 months,5 months to 1 year ago,Great banana and cool flavor,This was my first favorite. It’s a little more sweet than I’d like but only because I had tried other flavors. It was hands down my first favorite and go to.,,,
482,5.0,12 months,5 months to 1 year ago,Hype max flow,Pretty solid. Not too sweet.,,,
483,5.0,12 months,5 months to 1 year ago,Love huff n puffers,This company is so professional and efficient! They really care about their customers!,,,
484,5.0,12 months,5 months to 1 year ago,Great product!,These are my favorites and unfortunately there are knock offs out there! I’ve ordered from huff and puffers about 4 or 5 times now and I’ve never received a bad Hyppe MAXX flow from them! Their products are real and high quality! : ),,,
485,5.0,12 months,5 months to 1 year ago,Great,Love the flavor,,,
486,5.0,12 months,5 months to 1 year ago,So GOOD,This product was really good,,,
487,5.0,12 months,5 months to 1 year ago,Love these,My favorite vape I’ve tried!!! Will definitely buy again,,,
488,5.0,12 months,5 months to 1 year ago,Wonderful service,I went into the store excellent customer service I will buy again.,,,
489,5.0,12 months,5 months to 1 year ago,Great flavor and smoke,Strawberry is the way to go!,,,
490,5.0,12 months,5 months to 1 year ago,Best milky strawberry,Love this flavor. The cost is good and lasts me somewhat long. Perfect balance of sweet and creamy.,,,
491,5.0,12 months,5 months to 1 year ago,Hype Max Flow Supreme Disposable,My flavor of choice is Lush Freeze. I LOVE it! Great price! Great product! Peter is FANTASTIC! This is one very happy customer!,,,
492,5.0,1 year,Less than 2 months,Great service.,Great customer service. Always having top shelf vapes available whenever I want.,,,
493,5.0,1 year,Less than 2 months,Strawberry sky aka strawberry gummy,"So far this is my all-time favorite. This particular brand seems to be the only one I have found that does not leave that nasty aftertaste, make me cough, or cause my chest to hurt. When I first started using the hyppe disposable, I bought them from my local Circle K and they lasted me almost two weeks. I was thrilled to find them for $7 less online from huff and puffers. I ordered from several different places online but this one has the best service and best price overall.
I must admit I probably use it more now that I do not smoke cigarettes at all, but now they only last two days. It's hard for me to imagine that I'm puffing THAT many more puffs then I was before. There are definitely not 2,000 puffs on any setting, because you would literally have to Puff every minute for every waking moment to use it in 2 days time. I use mine on the lowest flow possible and it gives a great hit and very full flavor. I was a pack a day smoker, so it's still cheaper than cigs. They have changed something in these, but they are still, hands down, the best on the market for me.",,,
494,5.0,1 year,Less than 2 months,Cucumber Berry,"This flavor was especially refreshing. This particular brand seems to be the only one I have found that does not leave that nasty aftertaste. My favorite is the strawberry sky or strawberry gummy but this is a nice refreshing change. When I first started using the hyppe disposable, they lasted me almost two weeks. I must admit I probably use it more now, but now they only last two days. It's hard for me to imagine that I'm puffing THAT many more puffs then I was before. Maybe they got a clue and reduced the amount in the vape but how will we ever know?",,,
495,5.0,1 year,Less than 2 months,Awesome!,Soo nice to be able to control air flow! Awesome!,,,
496,5.0,1 year,Less than 2 months,Must have!!,This is one of my flavor and puff that I really like it.,,,
497,5.0,1 year,Less than 2 months,Went back for some more Naked,"Was afraid they might run out of stock like the other store local to me did, so went back to stock up on some more. Forgot to mention in my previous review that their prices are good. They were lower than the local shop I normally went to and better or competitive with other online only shops.",,,
498,5.0,1 year,Less than 2 months,Naked the smoothest flavor I found so far,"Have had no issues with hits causing me to cough or harshness. Naked is not flavorless. It's mild/medium spearmint flavor ICED. Got brain freeze many times while using it.
So far I used 6-7 units. No defective units and I believe they all lasted about the same amount of time. Currently one unit lasts me about 3-5 days, but I'm still smoking and don't typically use them when I'm home.
Luckily this shop is local to me and I can drive over to purchase what I want. All the people who've helped me so far were nice. It's nice to be able to check their site to see what's in stock before driving over to make a purchase.",,,
499,5.0,1 year,Less than 2 months,Good Draw,"Good draw, convenient",,,
500,5.0,1 year,Less than 2 months,Banana freeze,Very good,,,
501,5.0,1 year,Less than 2 months,Love it Banana Breeze is # 1,ive tried different flavors this takes the win.,,,
502,4.0,1 year,Less than 2 months,Tasty,I give it two thumbs up,,,
503,3.0,1 year,Less than 2 months,I like,"They work great, tasty i would recommend but I go through these pretty quick.",,,
504,5.0,1 year,Less than 2 months,hyppe max flow,good product,,,
505,4.0,1 year,Less than 2 months,It was ok,👍🏻,,,
506,5.0,1 year,Less than 2 months,Must have,Taste all the notes of flavor with a smooth flow every puff,,,
507,5.0,1 year,Less than 2 months,Sweet orange,"Delicious vapor of sweet orange, smooth, lasts me 3 days on max flow",,,
508,5.0,1 year,Less than 2 months,Super flavor,"Awesome smooth lasting, my fav flavor of all hyppes",,,
509,5.0,1 year,Less than 2 months,Best vape shop around.!,"Wether it’s a quick stop for my usual disposal vapes or I’m shopping around for something different for a change, these guys are informative, always have good quality products and the best flavors.! It’s my go-to vape shop.! You won’t be disappointed.!",,,
510,5.0,1 year,Less than 2 months,My fav,My favorite disposable vape pen hands down!,,,
511,5.0,1 year,Less than 2 months,My fav,My favorite disposable vape pen hands down!,,,
512,5.0,1 year,Less than 2 months,My favorite,My favorite disposable vape pen hands down!,,,
513,5.0,1 year,Less than 2 months,The best,I’ve been ordering my vapes regularly from them. Easiest and most pleasant experience ever. They are super quick to get me my order and are quick to respond to any questions I have. When I put the wrong address on my order they were so quick to act on it and correct it for me after it was already on the way. Thank you guys and I am forever grateful and proud to be a customer!,,,
514,5.0,1 year,Less than 2 months,love it,always buy the same and i love it,,,
515,5.0,1 year,Less than 2 months,Awesome Flavor.,Great flavor combination definitely an all day vape. Will definitely be having this in my everyday rotation.,,,
516,4.0,1 year,Less than 2 months,Pretty Good,Flavor is light compared to some of other flavors ice had before but good enough.,,,
517,5.0,1 year,Less than 2 months,Great service,Great quality,,,
518,5.0,1 year,Less than 2 months,Good,Like this one,,,
519,5.0,1 year,Less than 2 months,Fave so far,Nice flavor,,,
520,5.0,1 year,Less than 2 months,Great glavor,Great service the product in excellent quality,,,
521,5.0,1 year,Less than 2 months,Good mint,Consistent vape,,,
522,5.0,1 year,Less than 2 months,Online ordering,Great service no complaints,,,
523,5.0,1 year,Less than 2 months,Satisfied,I am very satisfied with purchase.,,,
524,5.0,1 year,Less than 2 months,Good,Hypemax brand is great,,,
525,4.0,1 year,Less than 2 months,Good,Good flavor lasts long,,,
526,4.0,1 year,Less than 2 months,Good,Fast shipping,,,
527,5.0,1 year,Less than 2 months,Great flavor!!,Nice and smooth!!,,,
528,5.0,1 year,Less than 2 months,Easy breezy,Out of all the disposables. I enjoy their flavors the most.,,,
529,5.0,1 year,Less than 2 months,Disposable Vape,These are my favorite disposables.......the prices and shipping time are amazing. Will be purchasing again for sure!,,,
530,5.0,1 year,Less than 2 months,Best brand so far,smooth and easy flavors.,,,
531,5.0,1 year,Less than 2 months,smooth draw,so far this is the best brand for the price. flavors are not to overly sweet and the adjustable feature is nice to control the intake.,,,
532,5.0,1 year,Less than 2 months,Fire,Great products no duds,,,
533,5.0,1 year,Less than 2 months,Fire,Great products no duds,,,
534,5.0,1 year,Less than 2 months,Good vape,Good vape. Some run out of flavor but it's mostly been good,,,
535,5.0,1 year,Less than 2 months,Good vape,Good. Vape for orice,,,
536,5.0,1 year,Less than 2 months,Great,Great customer service too,,,
537,5.0,1 year,Less than 2 months,Convenient,"When your on the go and don’t have time for a smoke break, I smoke these in my car and it leaves no after smell",,,
538,4.0,1 year,Less than 2 months,Friendly,Easy to use good for disposable,,,
539,5.0,1 year,Less than 2 months,Lush Freeze best flavor!,"Sweet, icy, smooth, & one pen lasts me almost a week!",,,
540,5.0,1 year,Less than 2 months,one of the best disposable out there,great number puffs and great taste,,,
541,5.0,1 year,Less than 2 months,Smooth flow - nice flavor.,The supreme flow is pretty nice - super smooth. The grape flavor is good too. One of my favorites.,,,
542,4.0,1 year,Less than 2 months,Great flavor,Love it,,,
543,5.0,1 year,Less than 2 months,Mighty Mint,This company ships faster than anyone I know. I like the Mint the best. It's got a nice cool throat hit. Never had any issues with device at all.,,,
544,5.0,1 year,Less than 2 months,Very good !!!,"I like the product since day one, they’re much cheaper in this website than at the gas station where I used to buy them. Love the taste and delivery was fast too.",,,
545,5.0,1 year,Less than 2 months,Recommend,Like it,,,
546,5.0,1 year,Less than 2 months,Good one,Pretty nice,,,
547,5.0,1 year,Less than 2 months,So fresh,Favorite for my mom,,,
548,5.0,1 year,Less than 2 months,Top,Best,,,
549,5.0,1 year,Less than 2 months,My favorites,Out of all the different brands I have used this is my favorite. I recommend these especially the strawberry freeze,,,
550,5.0,1 year,Less than 2 months,good,good,,,
551,5.0,1 year,Less than 2 months,good product,yum,,,
552,5.0,1 year,Less than 2 months,It’s so good,I loved,,,
553,5.0,1 year,Less than 2 months,good,try it,,,
554,5.0,1 year,Less than 2 months,good stuff,good product,,,
555,5.0,1 year,Less than 2 months,good stuff,one of favs,,,
556,5.0,1 year,Less than 2 months,Smooth long lasting puff,Just enough flavor and hit to fulfill a single puff of satisfaction.,,,
557,5.0,1 year,Less than 2 months,Yum!,I like the PF!,,,
558,5.0,1 year,Less than 2 months,Best Disposables,"Always a trustworthy choice with many options. Lasts at least a few days (heavy smoker), great flavor choices, and rarely ever taste burnt towards the end!",,,
559,5.0,1 year,Less than 2 months,Excellent,I love being able to adjust the flow and get harder hits.,,,
560,5.0,1 year,Less than 2 months,My go to vape,Love this vape. All their flavors are amazing and not too strong. It hits thick and smooth,,,
561,5.0,1 year,Less than 2 months,Delicious,Treat yourself,,,
562,5.0,1 year,Less than 2 months,Really good,Most flavors are great,,,
563,5.0,1 year,Less than 2 months,I like it nice smooth,It’s a good product,,,
564,5.0,1 year,Less than 2 months,Hyppe Max flow,Love the unflavored or aka naked. Lasts a long time,,,
