Review_id,Ratings,Dates,Date_Category,Heads,Texts,Flavor,Sweet,Lasting
641,3.0,11 months,5 months to 1 year ago,"Prefer the gio more, but still good",Flavors are a hit or miss. Strawberry mango is my favorite,,,
642,5.0,11 months,5 months to 1 year ago,I LOVE FLUM FLOAT,"I first discovered this brand while I was on vacation in Las Vegas, my cousins couldn't get over how great tasting Aloe Grape was so I needed to try it. I bought Aloe Grape and the Limited Edition Strawberry Ice cream and I was so blown away. I purchased to Huff and Puffers several flavors and they came in less than 5 days. Fruity Hawaii is 9/10, Strawberry Ice Cream is 9/10, Aloe Grape is 20/10, and the Breeze is -500/10 (You don't want this flavor trust me, if air freshener becomes a flavor its this one)",,,
643,5.0,11 months,5 months to 1 year ago,Flum,Great taste!,,,
644,5.0,11 months,5 months to 1 year ago,Flum,Great flavor,,,
645,5.0,11 months,5 months to 1 year ago,strawberry mango flum,"aight everyone. SIT DOWN. OR STAND UP. CUZ THIS. this is FIYAh. this is one of my favorite flum flavors too.. taste like.. MANGO WHITECLAW . YES EXACTLY THAT. ye if u like mango whiteclaw this flums for u man. yes,",,,
646,5.0,11 months,5 months to 1 year ago,peach gelato.,ok. peach gelato. i only tried dis cuz my friend had it and its one of her favorite flavors. ye. its pretty good. taste sweet but not to sweet . i'd try it if u were interested . yes.,,,
647,5.0,11 months,5 months to 1 year ago,gummy drop top.,aight. gummy drop..... this was kinda fiyah not gonna lie.. its pretty sweet n yummy tastes like MFING CAAAAANDY. yes.,,,
648,5.0,11 months,5 months to 1 year ago,Classic and Delicious,The title says it all!,,,
649,5.0,11 months,5 months to 1 year ago,Best of the best,Hands down my favorite. Smooth and tasty,,,
650,5.0,11 months,5 months to 1 year ago,Average,It’s pretty good. Does not compare to the my favorites which is the Hawaii and aloe grape,,,
651,5.0,11 months,5 months to 1 year ago,Great,Fantastic and go to flavor,,,
652,5.0,12 months,5 months to 1 year ago,love this flavor,lots of verity and flum is a favorite,,,
653,5.0,12 months,5 months to 1 year ago,favorite flavor,love flum,,,
654,5.0,12 months,5 months to 1 year ago,Get it!,"For only $16 it’s a steal, any where else chargers you been 20-25. Good flavor that last until it dies!",,,
655,5.0,12 months,5 months to 1 year ago,Flum!,New flavor same great product! Gonna be a must have of mines now!,,,
656,4.0,12 months,5 months to 1 year ago,Good flavor,They were out of litchi ice so I tried this. The flavor was dragonfruit litchi. It was good I would get it again.,,,
657,5.0,12 months,5 months to 1 year ago,Great vape,My go to vape,,,
658,5.0,12 months,5 months to 1 year ago,Go to flavor,it really feels like I’m in flavortown,,,
659,5.0,12 months,5 months to 1 year ago,Great taste,I’ve never sucked on something so hard lol,,,
660,5.0,12 months,5 months to 1 year ago,Immaculate,So good that it deserves an SAT word :),,,
661,4.0,12 months,5 months to 1 year ago,Not a disappointment,Way better than nicotine patches,,,
662,5.0,12 months,5 months to 1 year ago,Perfection,Everytime I hit it i feel like I’m on cloud 9,,,
663,5.0,12 months,5 months to 1 year ago,Amazing,Smooth finish great taste,,,
664,5.0,12 months,5 months to 1 year ago,Great,Flavor is amazing my favorite flum flavor of all time,,,
665,5.0,12 months,5 months to 1 year ago,Fav flavor,Bought more than once... love the taste,,,
666,5.0,12 months,5 months to 1 year ago,Tastes like candy,Really helps with my eating disorder,,,
667,5.0,12 months,5 months to 1 year ago,Fave brand,10/10,,,
668,5.0,12 months,5 months to 1 year ago,Good flavor,Love this flavor,,,
669,5.0,12 months,5 months to 1 year ago,Simple and lasting,Strawberry Mango is my favorite top 5 from this brand,,,
670,5.0,12 months,5 months to 1 year ago,Excellent,Always an excellent product and experience when coming to the store.,,,
671,5.0,12 months,5 months to 1 year ago,Best hit,Flavor and menthol hits. Best juice ever. Better then a menthol cigarette,,,
672,5.0,12 months,5 months to 1 year ago,Best menthol flavor ever,Great smoke but the menthol hits hella good. One of the best I can’t even find this juice anywhere,,,
673,5.0,1 year,Less than 2 months,Legit,"After being duped into buying fake ones, glad I found them & way more inexpensive than other shops.",,,
674,5.0,1 year,Less than 2 months,One of my go to's,Bomb flavor,,,
675,5.0,1 year,Less than 2 months,Light and fruity,It has a consistent taste which is also easy on the throat hits:),,,
676,5.0,1 year,Less than 2 months,Great vape,I ordered a couple vapes and the shipping was fast!,,,
677,5.0,1 year,Less than 2 months,Friendly service,Love the flavor,,,
678,5.0,1 year,Less than 2 months,Sooo good!,One of my favorites! Would recommend!,,,
679,5.0,1 year,Less than 2 months,Great product & great staff online & in store,The product was legit !,,,
680,5.0,1 year,Less than 2 months,Flum Gummie Drop,"Great taste, one of the best flavors in a disposable.",,,
681,5.0,1 year,Less than 2 months,Awesome,Great flavor,,,
682,5.0,1 year,Less than 2 months,Best flavor,Lush ice is the best flavor & very smooth,,,
683,5.0,1 year,Less than 2 months,Flavor is spot on,I really enjoyed the flavor and that icy/menthol was really nice,,,
684,5.0,1 year,Less than 2 months,Stoked,The guys @ huff puff always make it easy to order and the flum I buy are in stock and come fast,,,
685,5.0,1 year,Less than 2 months,good,great,,,
686,5.0,1 year,Less than 2 months,Review,Last a long time good flavor,,,
687,5.0,1 year,Less than 2 months,bomb,flum always have the best flavors and they last pretty good,,,
688,5.0,1 year,Less than 2 months,Strawmelon Strawmelon is good to go…lol,"I think this is my favorite sweet flavor. I’m a cool mint gal, but always buy a sweet one too. And I finally found it. Try it out! You will not be disappointed. Thank you!!",,,
689,5.0,1 year,Less than 2 months,Go to disposable,One of my favorite flavors,,,
690,5.0,1 year,Less than 2 months,Gummy Drop,This is one of my favorites,,,
691,5.0,1 year,Less than 2 months,Smooth and tasty,Smooth and tasy,,,
692,5.0,1 year,Less than 2 months,Smooth and tasty,Smooth and tasty,,,
693,5.0,1 year,Less than 2 months,Tasty smooth flow,Great flavor and hits smooth til the last drop!,,,
694,5.0,1 year,Less than 2 months,"Easy, breezy, cover girl.","Easy to use, doesn't leave a discerning scent and lots of puffs for the cost.",,,
695,5.0,1 year,Less than 2 months,Amazing.,Favorite one,,,
696,5.0,1 year,Less than 2 months,Amazing flavor,If you like strawberry melon or strawberry watermelon then you’ll like strawberry ice cream :)),,,
697,5.0,1 year,Less than 2 months,Vape,Nice and fruity,,,
698,5.0,1 year,Less than 2 months,Best disposable,This is the best tasting disposable I've found. Only thing that would make it better is rechargable,,,
699,5.0,1 year,Less than 2 months,Good,This my favourite flavor and lasts a long time,,,
700,5.0,1 year,Less than 2 months,Amazing!,Flavor was good :),,,
701,5.0,1 year,Less than 2 months,EXCELLENT,You guys are AWESOME & Love the quick delivery,,,
702,5.0,1 year,Less than 2 months,Rich flavor,Nice clouds,,,
703,5.0,1 year,Less than 2 months,Best Flavor,Hands down best flum flavor out there.,,,
704,5.0,1 year,Less than 2 months,Great taste.,Best flavor out there.,,,
705,5.0,1 year,Less than 2 months,Great Product!,Great flavor and price!,,,
706,5.0,1 year,Less than 2 months,Great Product,Great flavor and price!,,,
707,5.0,1 year,Less than 2 months,Love it!,"I use to smoke for years and then discovered Juul. They were good but so expensive. A friend recommended me to Flum, and they last so much longer and are more reasonable price-wise than Juul.",,,
708,5.0,1 year,Less than 2 months,The best,It's tasty. Another great flavor from Flum. Awesome packaging and amazingly quick shipping from Huff. You guys rock. The extra care you guys take to ensure my package arrives safe is great.,,,
709,5.0,1 year,Less than 2 months,Love,Love,,,
710,5.0,1 year,Less than 2 months,Best flavor,I love the flavor and enjoy it. Will buy more!,,,
711,5.0,1 year,Less than 2 months,Great!,Love all the flavors and the air flow is smooth,,,
712,5.0,1 year,Less than 2 months,Great,Pina pollo awesome,,,
713,5.0,1 year,Less than 2 months,Nice new flavors,Peach ice is a good new addition to flums line up,,,
714,5.0,1 year,Less than 2 months,Lasting flavor,love the flavor and super easy to use,,,
715,5.0,1 year,Less than 2 months,awesome,my favorite vape!,,,
716,5.0,1 year,Less than 2 months,Great price for Flum!,This is the best price I've seen for all vapes! The flum was great!,,,
717,5.0,1 year,Less than 2 months,Very tasty,I love flum flavors! Very tropical,,,
718,5.0,1 year,Less than 2 months,Nice,Dope,,,
719,5.0,1 year,Less than 2 months,Good,Awesome,,,
720,5.0,1 year,Less than 2 months,Great!,Awesome flavor,,,
721,5.0,1 year,Less than 2 months,Really helps while im trying to quit!,"This is pleasant tasting and really helps as I am into week 4 of quitting the cigs. highly recommend buying off their website, fast shipping and less than what you would pay at a gas station, etc.",,,
722,5.0,1 year,Less than 2 months,great vape!,love this flavor!,,,
723,5.0,1 year,Less than 2 months,Flum float cool mint…,I ordered 8 pens and every one worked great!,,,
724,5.0,1 year,Less than 2 months,Awesome,All the favorite,,,
725,5.0,1 year,Less than 2 months,Favorite,Great flavor,,,
726,5.0,1 year,Less than 2 months,Great flavor,One of my favs,,,
727,5.0,1 year,Less than 2 months,Flum,Good flavors and last long,,,
728,5.0,1 year,Less than 2 months,Flum fruity hawaii,My favorite flavor,,,
729,5.0,1 year,Less than 2 months,Gummy drop flum,Good flavor,,,
730,5.0,1 year,Less than 2 months,Good vape,Good vape and flavors,,,
731,5.0,1 year,Less than 2 months,Smooth,Will try the other flavors too.,,,
732,5.0,1 year,Less than 2 months,Great experience,Awesome product,,,
733,5.0,1 year,Less than 2 months,Love these,This is my new go to and love that you get 3000 puffs full taste and smooth,,,
734,5.0,1 year,Less than 2 months,Wow,"Great flavor, and smooth doesn't make you choke !",,,
735,5.0,1 year,Less than 2 months,My favorite,"This is my first and my favorite flavor!! Never disappoints, and always on point!! Recommend every time !!!",,,
736,5.0,1 year,Less than 2 months,Vape,"Great, smooth taste and flavor!!! Taste what it's supposed to!!",,,
737,5.0,1 year,Less than 2 months,Vape,"Great flavor, taste what's it's supposed to, doesn't go dry, or give a dry hit, it's rare for on to have a burnt taste, and doesn't make you choke, smooth",,,
738,4.0,1 year,Less than 2 months,A good alternative flavor,"Strong, good flavor.",,,
739,5.0,1 year,Less than 2 months,Awesome Flavor,"One of my ""go-to"" flavors. Never gets old.",,,
740,5.0,1 year,Less than 2 months,Awesome Flavor,"This is one of my ""go to"" flavors",,,
741,5.0,1 year,Less than 2 months,Awesome,The strawberry milkshake flavor is one of my favorite disposables,,,
742,5.0,1 year,Less than 2 months,Love it!,Great flavor,,,
743,5.0,1 year,Less than 2 months,Great flavor,One of my favorites!,,,
744,5.0,1 year,Less than 2 months,Best flavor since juul mango,"Complete flavor, with regard for taste",,,
745,4.0,1 year,Less than 2 months,Best flavors,"These Flum Floats have some of the best flavors.
These things are rated at 3000 puffs, which is mostly true, but every once in a while, there will be one disposable with a battery life with maybe half of that.",,,
746,5.0,1 year,Less than 2 months,Flum float,These vapes are great because I don’t vape very often during the day. One cartridge can last me up to a month and a half. It helped to transition me from cigarettes before I quit also.,,,
747,5.0,1 year,Less than 2 months,Love these,Great flavor and they last a good while. Haven’t had any issues with them at all.,,,
748,5.0,1 year,Less than 2 months,Love it!,I love the flum float! I do not use any other disposable vape.,,,
749,5.0,1 year,Less than 2 months,Nice taste,👍🏼,,,
750,5.0,1 year,Less than 2 months,Vape,"Good price, great flavor",,,
751,5.0,1 year,Less than 2 months,Flum float,Simply the best. Won't ever shop another brand!,,,
752,5.0,1 year,Less than 2 months,Flum float,"Been vaping now for around 9yrs. Best hit, and the juiciest flavors!",,,
753,5.0,1 year,Less than 2 months,Flum float,Smoothest draw around. Delicious flavor!,,,
754,3.0,1 year,Less than 2 months,If you like em super sweet,I wasn’t a fan but the product that HP sent was high quality and lasted a good amount of time.,,,
755,5.0,1 year,Less than 2 months,Last long with great flavor,Switched from Juul to flum. 1000% recommend. Love how long these last and the cool mint is *chefs kiss*. Not too sweet on your tongue and feels like a breath of fresh air.,,,
756,3.0,1 year,Less than 2 months,Clear,It is very strong,,,
757,5.0,1 year,Less than 2 months,Flavors,Good selection of flum. Last a long time. I recommend them.,,,
758,5.0,1 year,Less than 2 months,Great!,Aloe grape is the one.,,,
759,5.0,1 year,Less than 2 months,Flum for the WIN,Great flavor!,,,
760,5.0,1 year,Less than 2 months,My go to,This is the best flavor,,,
761,5.0,1 year,Less than 2 months,Great,Love the service,,,
762,5.0,1 year,Less than 2 months,Long lasting,Very sweet,,,
763,5.0,1 year,Less than 2 months,Peach 🍑,Best peach flavor this is my favorite,,,
764,5.0,1 year,Less than 2 months,Delicious,Delicious,,,
765,5.0,1 year,Less than 2 months,Delicious,So tasty,,,
766,5.0,1 year,Less than 2 months,Get 'em,So happy with these. Grape aloe is my fave,,,
767,5.0,1 year,Less than 2 months,Love them!,Always great quality. I love the strawberry flavor. Is so smooth and delicious. Always purchasing more to have internet stock,,,
768,5.0,1 year,Less than 2 months,Friend loves this vape,It’s her go to fav disposable,,,
769,5.0,1 year,Less than 2 months,Excellent customer service!,Excellent customer service! I have bought from several different companies but this is my favorite. They take care of you!,,,
770,5.0,1 year,Less than 2 months,Great taste,One of my favorite flums,,,
771,5.0,1 year,Less than 2 months,Great taste,"One of my top favorite flavors, Flum is the way to go.",,,
772,5.0,1 year,Less than 2 months,Always on point with flavor,These flume products are the best and most flavorful!,,,
773,5.0,1 year,Less than 2 months,Nice,It’s great,,,
774,5.0,1 year,Less than 2 months,Love it,Good presentation,,,
775,5.0,1 year,Less than 2 months,Good Company,Good service and good products,,,
776,5.0,1 year,Less than 2 months,Great flavor,Great flavor and the shape of the canister is easy to hold,,,
777,5.0,1 year,Less than 2 months,Always good,Awesome,,,
778,5.0,1 year,Less than 2 months,Good place to buy products.,I have been buying there products for awhile now and it is good.,,,
779,5.0,1 year,Less than 2 months,fave!,good flavor!,,,
780,5.0,1 year,Less than 2 months,Flum float,Flavor is awesome last me about 5-6 days,,,
781,5.0,1 year,Less than 2 months,Inexpensive & Quick Shipment,The flum floats are at a reasonable price. Shipping is always in a timely manner. Store clerks have great communication.,,,
782,5.0,1 year,Less than 2 months,Pina Colada,I came back from Cabo San Lucas and still had the taste for Pina Colada. This was perfect! Flavor just like the real Pina Colada and gave me the reminiscence of Cabo. One of my favorites!!!,,,
783,5.0,1 year,Less than 2 months,Best vape I’ve ever purchased!,So smooth! I love It!,,,
784,5.0,1 year,Less than 2 months,Great flavor,Great flavor and great price!,,,
785,5.0,1 year,Less than 2 months,Absolutely fantastic !!!,"I've only been getting the Flumes for a few months.
But all of the flavors I've tried r absolutely fantastic !!!",,,
786,5.0,1 year,Less than 2 months,One of my favorites,Smooth and flavor lasts a long time,,,
787,5.0,1 year,Less than 2 months,love!,"tastes good, love flum!",,,
788,5.0,1 year,Less than 2 months,This brand has great flavors!,"I loved the way they tasted, just wished they'd last a little longer lol!",,,
789,5.0,1 year,Less than 2 months,A+,Great!,,,
790,5.0,1 year,Less than 2 months,Fruity,Nice for summer,,,
791,5.0,1 year,Less than 2 months,flum disposable,great draw great flavor more on the tighter side but chill workers n highly recommend,,,
792,5.0,1 year,Less than 2 months,Great,Nice flavor,,,
793,5.0,1 year,Less than 2 months,Sweet,"This is a sweet flavor, but it is one of my favorites! Strawberry cream is my number 1.",,,
794,5.0,1 year,Less than 2 months,Great,Flavor was great and items shipped very fast,,,
795,5.0,1 year,Less than 2 months,Awesome flavor,I will definitely buy again and have not been disappointed. Been a customer for half a year.,,,
796,5.0,1 year,Less than 2 months,Yummmmmm,"Just tastes sweet, like sugar",,,
797,5.0,1 year,Less than 2 months,"Great service, great flavor",Great service and great flavor!,,,
798,5.0,1 year,Less than 2 months,Flavorful,Accessible,,,
799,5.0,1 year,Less than 2 months,Yummmy,The flavor was delicious,,,
800,5.0,1 year,Less than 2 months,Great,"Consistent product, will purchase again.",,,
801,5.0,1 year,Less than 2 months,Tastes good,yummy,,,
802,5.0,1 year,Less than 2 months,Great customer service,Really great prices,,,
803,5.0,1 year,Less than 2 months,Aloe grape,My wife loves this one is not too sweet like other flavors but still has some flavor,,,
804,5.0,1 year,Less than 2 months,Tastes great,Lasts me about a week and has very good flavor,,,
805,5.0,1 year,Less than 2 months,My favorite disposable,This is the best tasting disposable I've ever found. Amazing flavor. Just doesn't last to long and wish it was rechargeable.,,,
806,5.0,1 year,Less than 2 months,Agreeable flavor,Pina polo is good and I will definitely grab it again.,,,
807,5.0,1 year,Less than 2 months,Tasty flavor,This flavor has become a staple.,,,
808,5.0,1 year,Less than 2 months,Good vape,This flum vape is better than the other brands I’ve tried.,,,
809,5.0,1 year,Less than 2 months,Sweet,The vape was sweet and lasted a decent amount of days.,,,
810,4.0,1 year,Less than 2 months,Enjoyable flavor,The vape had a good flavor that wasn’t overbearing.,,,
811,4.0,1 year,Less than 2 months,Worked well,The vape lasted a good while and the flavor was pretty good,,,
812,5.0,1 year,Less than 2 months,Satisfactory,Product performed and did not disappoint,,,
813,5.0,1 year,Less than 2 months,Good,The product has a sweet flavor that isn’t to overpowering.,,,
814,5.0,1 year,Less than 2 months,Overall great experience,"I've had several flavors and I'm always happy every time I order from huff and puffers. Much prefer it compared to a vape shop or convenience store.
Accounting for the shipping cost it's just a bit cheaper than in person purchasing",,,
815,5.0,1 year,Less than 2 months,If you love grape juice this is a one of a kind.,Love it must buy.,,,
816,5.0,1 year,Less than 2 months,Great disposable,Amazing flavor,,,
817,5.0,1 year,Less than 2 months,Good,Love it!!,,,
818,4.0,1 year,Less than 2 months,Great flavors but not long lasting,"Tropical delight and lychee are great flavors, but these only last about 2 days. They don't last as long as expected",,,
819,5.0,1 year,Less than 2 months,Not don,Great,,,
820,5.0,1 year,Less than 2 months,Great,Great,,,
821,5.0,1 year,Less than 2 months,Taste great,Thought why not and got it to try and taste amazing,,,
822,5.0,1 year,Less than 2 months,Solid,Strawmelon was super flavorful and last a while,,,
823,4.0,1 year,Less than 2 months,Good flavors but doesn’t last,Lots of flavors and they’re all good but after awhile they start to not produce much vapor,,,
824,4.0,1 year,Less than 2 months,"Lasts awhile, flavor is there",Long lasting and the taste is pretty strong throughout. As the bar dies though you can definitely taste the impact in flavor.,,,
825,4.0,1 year,Less than 2 months,Trying new flavor,First time trying this flavor. Loved it.,,,
826,5.0,1 year,Less than 2 months,Great!!!!,Great products,,,
827,4.0,1 year,Less than 2 months,Flavorful,Flum is the only vape without menthol flavors. My fav,,,
828,5.0,1 year,Less than 2 months,Smooth & Delicious,Strong flavor & long lasting. It is my regular go to,,,
829,5.0,1 year,Less than 2 months,Smooth,Long lasting and good product. Doesn't taste old or finish quickly,,,
830,5.0,1 year,Less than 2 months,A sweeter Aloe Grape,I am torn between this and aloe grape as my favorite flavor. It’s super nice to pull and the flavor hits you throat less harsh than aloe grape. Overall it has became my favorite vape,,,
831,5.0,1 year,Less than 2 months,Delicious,Scrumptious flavor,,,
832,5.0,1 year,Less than 2 months,Gummy drop,Very flavorful and great quality product,,,
833,5.0,1 year,Less than 2 months,Flum,Flavors great on the Flum floats! My favorite brand so far,,,
834,5.0,1 year,Less than 2 months,Delicious flavor!,These disposables last long and the flavors are amazing!,,,
835,5.0,1 year,Less than 2 months,Long lasting and rich flavor,Great product batteries last a while and flavor stays strong the hole time.,,,
836,5.0,1 year,Less than 2 months,Long lasting flavor,Long lasting flavor with rich flavor,,,
837,4.0,1 year,Less than 2 months,Mellow and sweet,"It was good, but not my favorite. On to the next one. Definitely better than Mint.",,,
838,5.0,1 year,Less than 2 months,Great service and friendly staff,Great taste and seem to last for a long time,,,
839,4.0,1 year,Less than 2 months,My partner loved it but it wasn’t for me,Very good menthol would definitely recommend to other folks,,,
840,5.0,1 year,Less than 2 months,favorite disposable,"great flavor, and perfect amount of puffs!",,,
841,5.0,1 year,Less than 2 months,Consistent,Cant go wrong w this flavor or brand,,,
842,1.0,1 year,Less than 2 months,Flavor ok but no smoke,Didn’t expect it to not blow out as much cloud as i get with the hypee max,,,
843,5.0,1 year,Less than 2 months,10/10,10/10,,,
844,5.0,1 year,Less than 2 months,10/10,does the job,,,
845,5.0,1 year,Less than 2 months,10/10,10/10,,,
846,5.0,1 year,Less than 2 months,10/10,10/10,,,
847,5.0,1 year,Less than 2 months,10/10,some good flavors under this brand,,,
848,5.0,1 year,Less than 2 months,10/10,10/10,,,
849,5.0,1 year,Less than 2 months,Always good,Can’t really go wrong with flums,,,
850,5.0,1 year,Less than 2 months,Creamy and flavorful,Taste exactly like strawberry ice cream. Hits very smooth and is very creamy.,,,
851,5.0,1 year,Less than 2 months,Pleasant,Flavor was good! Only downside is it doesn’t last too long,,,
852,4.0,1 year,Less than 2 months,flum strawberry mango,the flavor is really good but it tends to leak. this is my second device from flum and both vapes leaked; unsure if it was just by coincidence or if it’s all flum products so it’s definitely something to keep in mind. the leak isn’t too bad though as long as you keep it upright when not in use.,,,
853,4.0,1 year,Less than 2 months,Great vape,Its a good product however it fires on its own couple times.,,,
854,5.0,1 year,Less than 2 months,Flum float,Favor is awesome,,,
855,5.0,1 year,Less than 2 months,Great,Good taste and great brand,,,
856,5.0,1 year,Less than 2 months,Long lasting disposable,"Its good, flavors are there with 3000+ puff but wish it can last a bit longer since I smoke this thing every so often",,,
857,4.0,1 year,Less than 2 months,Good disposable,Prefer my aegis pod,,,
858,3.0,1 year,Less than 2 months,Taste good…,Taste good but a little harsh. Could be smoother,,,
859,5.0,1 year,Less than 2 months,Great Product,Authentic products and great flavors. Definitely my go to brand and store!,,,
860,5.0,1 year,Less than 2 months,husband loves these,husband likes this brand and multiple flavor offerings.,,,
861,5.0,1 year,Less than 2 months,Flum Float Strawmelon,Best flavor ever! My number one!,,,
862,5.0,1 year,Less than 2 months,My go to brand!,Flums are my go to and they never disappoint,,,
863,5.0,1 year,Less than 2 months,Fruity Hawaii,Favorite flavor,,,
864,5.0,1 year,Less than 2 months,Awesome,⭐️ ⭐️ ⭐️ ⭐️ ⭐️,,,
865,5.0,1 year,Less than 2 months,By far the best!,The flum floats are by far the best disposable vapes I’ve ever used! The flavor is incredible and they last at least twice as long as any other ones that I’ve used! I’ve tried multiple flavors too and haven’t had a bad one yet!,,,
866,5.0,1 year,Less than 2 months,great vapes,flavor is great and they last a long time,,,
867,1.0,1 year,Less than 2 months,Fruity hawaii,Kind of tastes like watermelon ice breakers to me and I'm not a fan,,,
868,5.0,1 year,Less than 2 months,Pretty good,Would buy again,,,
869,5.0,1 year,Less than 2 months,❤️,The flavor is amazing highly recommend!,,,
870,5.0,1 year,Less than 2 months,The best,Great flavor,,,
871,5.0,1 year,Less than 2 months,good taste reasonable price,good taste reasonable price,,,
872,4.0,1 year,Less than 2 months,Great flavor,Great flavor but needs adjustable air flow,,,
873,5.0,1 year,Less than 2 months,Buying a disposable vape,The vape lasted really long and it tasted really good,,,
874,5.0,1 year,Less than 2 months,the best,We’ve been ordering in bulk for the past couple of months and it’s been the best. You can’t beat this price and shipping is always fast. Highly recommend.,,,
875,5.0,1 year,Less than 2 months,I have a favorite,Customer service was amazing. There's a lot of great flavors but in my opinion the best one is Gummy Drop!,,,
876,5.0,1 year,Less than 2 months,Flume!!!,All of the flume bars are fire 10/10 get them!!! Huff n puffers is also my fave local smoke shop they have the best deals and I never have a problem with duds!,,,
877,5.0,1 year,Less than 2 months,Fan Fave,Very flavorful,,,
878,5.0,1 year,Less than 2 months,Great prices and amazing flavor,Bought a good amount and only 1 out of all of them wasn’t working till I gave it a good hit on my knee. Better than most other disposables on the market imo,,,
