Review_id,Ratings,Dates,Date_Category,Heads,Texts,Flavor,Sweet,Lasting
214,5.0,1 year,Less than 2 months,Love this vape,Highly recommend the green apple it’s my favorite.,,,
215,5.0,1 year,Less than 2 months,Great flavor,Smooth tobacco flavor. Definitely would recommend,,,
216,5.0,1 year,Less than 2 months,Peach Ice Tea,Reminiscent of the O.G. Flavors when we had build our old mods and mix juices to get this unique flavor,,,
217,5.0,1 year,Less than 2 months,good green apple,taste like jolly rancher’s green apple if that your thing.,,,
218,5.0,1 year,Less than 2 months,10/10,I love the flavor.,,,
219,5.0,1 year,Less than 2 months,Good,Good,,,
220,5.0,1 year,Less than 2 months,Yummy,It's one of the best ones I've had. And doesn't leak or act up,,,
221,5.0,1 year,Less than 2 months,It's great!,Tastes really nice and not too overwhelming.,,,
222,5.0,1 year,Less than 2 months,Peach Ice Tea Flum,Taste like the intended flavor,,,
223,5.0,1 year,Less than 2 months,Vapes,Great prices.,,,
224,5.0,1 year,Less than 2 months,best one yet!,this was good: flavor and hit,,,
225,5.0,1 year,Less than 2 months,Very good,Very good flavor and smooth hit,,,
226,5.0,1 year,Less than 2 months,Long Lasting Vape,This is one of my favorite disposable vapes due to the flavors and puff counts. It last longer than most of the disposable vapes I buy. I also like the design: it's compact and sleek.,,,
227,5.0,1 year,Less than 2 months,Blueberry fusion,"The blueberry fusion has a blueberry candy taste and, a hint of coolness in my opinion, I love it. My only complaint is the rubber casing. When I leave it in my pocket or purse it picks up lint and crumbles around the mouth piece. But flavor is great!",,,
228,4.0,1 year,Less than 2 months,Great,👍,,,
229,5.0,1 year,Less than 2 months,Love the flavor last long,Fast delivery great flavor,,,
230,5.0,1 year,Less than 2 months,Fast delivery,Best yet! Love the flavor,,,
231,5.0,1 year,Less than 2 months,Love it!,Love this one,,,
232,3.0,1 year,Less than 2 months,Exellent,Good flavor,,,
233,5.0,1 year,Less than 2 months,One of favorites,Recommend,,,
234,5.0,1 year,Less than 2 months,One of my bestie,Love it!,,,
235,5.0,1 year,Less than 2 months,Love it !,My go to pen! AMAZING flavor!,,,
236,5.0,1 year,Less than 2 months,My favorite,Never disappoints and my literal go to pen!,,,
237,5.0,1 year,Less than 2 months,Jucy apple is my favorite flavor.,Love the taste,,,
238,5.0,1 year,Less than 2 months,Flavor,Good flavor tight draw,,,
239,5.0,1 year,Less than 2 months,Love the flavor,Super tasty. Love the iciness,,,
240,5.0,1 year,Less than 2 months,Cute and long lasting,Taste and smell good. Cool sensation,,,
241,5.0,1 year,Less than 2 months,Do you like the Lychee fruit?,"Do you like the Lychee fruit? If yes, must try this flavor! It's more minty than the fruit but the taste is almost the same. I also like the new grip. Feels like it won't slip and fall from my hand.",,,
242,4.0,1 year,Less than 2 months,pretty good!,love all flums but this flavor is ok. tastes sweet and tropical for sure.,,,
243,5.0,1 year,Less than 2 months,For all the coffee lovers,This is my girlfriends favorite especially to puff on with her morning coffee,,,
244,5.0,1 year,Less than 2 months,Enjoy,My type of flavor,,,
245,3.0,1 year,Less than 2 months,good flavor,This is the only flavor I like so far. A little minty and not too sweet. Forsure NOT 3000 puffs. Only lasts me about 5 days and I’m not constantly vaping.,,,
246,5.0,1 year,Less than 2 months,Great!,Awesome disposable vape. Killer flavor and great customer service.,,,
247,5.0,1 year,Less than 2 months,Taste like red bull too me i like it,If yoy like energy drinks i say go with this flavor,,,
248,5.0,1 year,Less than 2 months,Tastes delicious,Smooth apple taste with a hint of ice. One of my new favorites up there with litchi ice.,,,
249,5.0,1 year,Less than 2 months,Coffee Pump!,Yum tastes exactly like a bold Vietnamese coffee,,,
250,5.0,1 year,Less than 2 months,tropical punch,this flavor is great and it lasted about 3 -4 days of constant vaping,,,
251,5.0,1 year,Less than 2 months,Great!,"Flavor was accurate, soft touch and just amazing!",,,
252,5.0,1 year,Less than 2 months,Great,Great flavor with no menthol which is nice! Love Flum,,,
253,3.0,1 year,Less than 2 months,Decent,I like the shell of the product but I don’t like the secondary menthol taste,,,
254,3.0,1 year,Less than 2 months,Different,Taste different than the one that doesn’t have the rubber but still ok like the other better though,,,
255,5.0,1 year,Less than 2 months,Great!,The berry fusion is always my go to whenever I pick up a device from here!,,,
256,4.0,1 year,Less than 2 months,"Hits very smooth, but not rechargeable","PROS:
- Very Similar to Lucid Air Vape
- Very thick cloud vape, fruity menthol flavor type
- Never dries out my throat
- Never makes me cough
- Satisfying hit if you take a big hit to supress the cigarette urges
CONS:
- Not rechargeable
- Rubbery type vape look not very appealing
- Battery dies out pretty fast if you frequently hit it back to back
- Semi Bulky Vape with small mouth piece, doesnt bother me but might be too big for others who prefer a smaller, skinnier vape",,,
257,5.0,1 year,Less than 2 months,Fantastic,"Since I started smoking this flavor i cant even think to change it , I really do like . Thank you",,,
258,5.0,1 year,Less than 2 months,Flum Gio,Great Flavor. Fast Shipping,,,
259,5.0,1 year,Less than 2 months,Great,Would get it again,,,
260,5.0,1 year,Less than 2 months,Blueberry,Solid flavor,,,
261,5.0,1 year,Less than 2 months,Coffee,Coffee,,,
262,2.0,1 year,Less than 2 months,Eh,Flum was one of my favorites disposable vape. Great selection of flavors. I never had problem with Flum before but this particular tropical punch is a no for me. Not sure if I got the defective one but i have to tilt the vape a certain way for the juice to flow. Also weird after taste.,,,
263,5.0,1 year,Less than 2 months,Good device,Has a nice feel when pulling from device and flavor is consistent!,,,
264,5.0,1 year,Less than 2 months,good flavor,good flavor and vapes well,,,
265,5.0,1 year,Less than 2 months,Favorite Flavor!,Very subtle but tasty flavor. love the silicon too! doesnt get dirty at the tip!,,,
266,5.0,1 year,Less than 2 months,Pretty good,would buy again,,,
267,5.0,1 year,Less than 2 months,Flum Float Coffee,Son loves it! Great taste!,,,
268,5.0,1 year,Less than 2 months,Great customer service!,There's a big variety of options and the customer service is amazing. Thanks guys!,,,
269,5.0,1 year,Less than 2 months,Flum Gio Lychee,i absolutely love the flum gios and the lychee one is my favorite flavor! it’s the best lychee disposable i’ve tried so far. i always buy this flavor and brand,,,
270,5.0,1 year,Less than 2 months,Flum gio litche,The litche ice flavor was really good. Highly recommend it,,,
271,5.0,1 year,Less than 2 months,My favorite,So far Flum Gio are my favorite. The rubbery coat is convenient and I feel it seems to last a little longer than the Float ones. I love the Power Bull flavor so far. I will keep buying.,,,
272,1.0,1 year,Less than 2 months,😆😆😆,Heard it was good and ended up not liking it!,,,
273,5.0,1 year,Less than 2 months,Best brand,Great flavor,,,
274,5.0,1 year,Less than 2 months,It’s ok!,7/10,,,
275,3.0,1 year,Less than 2 months,Tropical Punch too sweet,"The hit is pretty good, the flavors are just too sweet. Tropical punch was off-putting and disappointing",,,
276,5.0,1 year,Less than 2 months,Flum Glo,This is one of the good ones. Great flavor and cool design,,,
277,4.0,1 year,Less than 2 months,Yummm,"Love the flavor, but still not a huge fan of Flum's small inhaler. Nevertheless, convenient with flums great quality. Always know what to expect which is probably why I keep coming back.",,,
278,5.0,1 year,Less than 2 months,Tropical Punch,I thought it was a very nice flavor. One of my top 10s,,,
279,5.0,1 year,Less than 2 months,Coffees,⭐️⭐️⭐️⭐️⭐️,,,
280,5.0,1 year,Less than 2 months,Lycee,Must buy highly recommend,,,
281,3.0,1 year,Less than 2 months,Not great,Harsh and not great lychee flavor,,,
