Review_id,Ratings,Dates,Date_Category,Heads,Texts,Flavor,Sweet,Lasting
1,5.0,11 hours,Less than 2 months,Awesome,I think you guys are awesome,5.0,5.0,5.0
2,5.0,12 hours,Less than 2 months,Lasts Long time,Great flavor and lasts a very long time,5.0,5.0,5.0
3,5.0,18 hours,Less than 2 months,I like these vapes,Last a while too,3.0,3.0,3.0
4,5.0,20 hours,Less than 2 months,Love this one.,Flavor was great and lasted a while.,5.0,5.0,5.0
5,5.0,3 days,Less than 2 months,Flum Pina Polo,This is great! Has the pineapple taste and no harsh nicotine bite. Try it!!,5.0,5.0,5.0
6,5.0,3 days,Less than 2 months,Delicious,Love the taste .,5.0,5.0,5.0
7,5.0,3 days,Less than 2 months,My outlet …,Great escape…grounding!,5.0,3.0,4.0
8,5.0,3 days,Less than 2 months,Plum,Great replacement for cigarettes no ashes,4.0,2.0,4.0
9,5.0,3 days,Less than 2 months,Review,Very good,5.0,5.0,5.0
10,5.0,4 days,Less than 2 months,Strawberry mango,Love it,5.0,5.0,4.0
11,5.0,4 days,Less than 2 months,AWESOME SAUCE !,I love this flavor . but the ORANGE is my faaaavorite and love how it slides in and out of my mouf !,5.0,5.0,5.0
12,3.0,5 days,Less than 2 months,Flum Skittle,Not my favorite but nobody’s fault just wanted to something new. Delivery was fast and free 😀,2.0,5.0,3.0
13,5.0,5 days,Less than 2 months,👍,Flavors good,5.0,5.0,3.0
14,5.0,5 days,Less than 2 months,Peach ice,Good product!,5.0,5.0,5.0
15,5.0,6 days,Less than 2 months,Flum floats,Good value,5.0,5.0,3.0
16,4.0,6 days,Less than 2 months,Love them.,Like them but lpve the puff extra zero,3.0,3.0,3.0
17,5.0,6 days,Less than 2 months,Good flavor,Will purchase again good flavor last what it should,5.0,4.0,5.0
18,3.0,6 days,Less than 2 months,Cotton Candy,While the flavor taste good it is NOT Cotton Candy flavored. Doesn’t taste anything like cotton candy. Very fruity. Again it taste good but not what I was expecting. It hits good and does last a long time.,3.0,3.0,5.0
19,5.0,7 days,Less than 2 months,Lush ice is bomb,I really like the lush ice flavor. Perfect balance of ice flavor.,5.0,4.0,4.0
20,5.0,7 days,Less than 2 months,Perfect Vape,Perfect flavor and very fast shipping,5.0,5.0,5.0
21,5.0,8 days,Less than 2 months,Fav,My go to blue raspberry,5.0,4.0,3.0
22,5.0,8 days,Less than 2 months,Great,Happy with product,5.0,5.0,4.0
23,4.0,8 days,Less than 2 months,Amethyst,I thought some of the flavors were great and others were a miss. I like to order ones that I know I like. And chance buying new ones.,4.0,4.0,4.0
24,5.0,8 days,Less than 2 months,Great product,"Flum makes the best products, and their flavors are top-of-the-line.",5.0,4.0,5.0
25,5.0,8 days,Less than 2 months,Great,I just want to say I hope these don’t go away!,5.0,4.0,5.0
26,5.0,9 days,Less than 2 months,One of my favorite flum flavors,"I love flum vapes in general, but this is one of my favorite flavors.",5.0,4.0,4.0
27,5.0,9 days,Less than 2 months,Would recommend,The flavor was good lasted as advertised. Definitely will buy again.,4.0,3.0,4.0
28,3.0,9 days,Less than 2 months,Pretty good,I do like this vape although it did not last as long as it said and I personally didn’t care for this flavor but overall love it.,2.0,2.0,2.0
29,5.0,9 days,Less than 2 months,My favorite disposable!,It's the best mint vape out there. I've tried at least a dozen different cool mint disposables and they all have a nasty sweet taste but not this one. If your lookin for a clean tasting cool mint I highly recommend this one❗,5.0,2.0,4.0
30,5.0,9 days,Less than 2 months,thanks!,I was hesitant to order online but all 10 delivered to my front door & quickly as well! I just ran out & about to put in a second order!,5.0,5.0,5.0
31,5.0,10 days,Less than 2 months,Flume Peach Ice,This is my go to,5.0,3.0,5.0
32,4.0,11 days,Less than 2 months,Pretty good,I like it,4.0,4.0,3.0
33,5.0,11 days,Less than 2 months,Love it,It taste really good and I love the fact that you could reuse the case if you don’t like to get the vape dirty,5.0,3.0,5.0
34,5.0,12 days,Less than 2 months,👍🏻,👍🏻,5.0,3.0,4.0
35,5.0,12 days,Less than 2 months,Blue Raspberry Ice,The vape itself is flavorful. My order came in two days! And this makes it easier to order and stock up again. :) very happy and would buy again from here.,5.0,5.0,5.0
36,5.0,13 days,Less than 2 months,Very pleased,"The Aloe Pinapple Ice is my favorite flum flavor, it’s the perfect vape for me!!!😁👍🏾👍🏾",5.0,3.0,4.0
37,1.0,13 days,Less than 2 months,Awesome,Exactly what I was expecting!!! Will order more for sure!!!,5.0,5.0,5.0
38,5.0,13 days,Less than 2 months,Cool mint,Great mint taste,5.0,3.0,3.0
39,5.0,13 days,Less than 2 months,Great quality,Great quality always get what I order.,5.0,4.0,4.0
40,5.0,14 days,Less than 2 months,All good here,I will buy more I am very satisfied these worked and did the job. Thank You for following up very professional I will order more soon,5.0,5.0,4.0
41,5.0,14 days,Less than 2 months,Yum,Great flavor great price,5.0,5.0,5.0
42,5.0,14 days,Less than 2 months,it was good,not my favorite but would smoke again,5.0,5.0,4.0
43,5.0,15 days,Less than 2 months,Love the Cotton Candy,Cotton Candy is my favorite!,5.0,5.0,5.0
44,5.0,15 days,Less than 2 months,Awesome!,It's a great flavor. I just wish there was a rechargeable version,5.0,4.0,4.0
45,5.0,15 days,Less than 2 months,I love these!,"I love the flavor and how much longer they last than other brands I have tried. My favorite ones are the blue raspberry, cotton candy, and lime romance.",5.0,4.0,5.0
46,5.0,15 days,Less than 2 months,Best flavor,Very good,5.0,5.0,5.0
47,5.0,15 days,Less than 2 months,Flume blue raspberry ice,"Pretty good flavor and sweetness, however only lasts a week or so but really good.",4.0,4.0,3.0
48,5.0,15 days,Less than 2 months,Great,Love this flavor and customer service,5.0,5.0,5.0
49,5.0,15 days,Less than 2 months,Great 👍,Taste awesome. Last a long time,5.0,1.0,5.0
50,5.0,15 days,Less than 2 months,Fruity Hawaii,The fruity hawaii is something you can vape and not get tired of the taste,5.0,5.0,5.0
51,5.0,16 days,Less than 2 months,ORDER!,great!!,5.0,5.0,5.0
52,5.0,16 days,Less than 2 months,Icy Berry Lemon,Very smooth ice flavor with a hint of berry and lemon.,5.0,3.0,5.0
53,5.0,18 days,Less than 2 months,Lush ice Flum,They are the absolute best!,5.0,5.0,3.0
54,5.0,18 days,Less than 2 months,Wonderful service,Happy I can get the flavor I wanted and fastest delivery,5.0,5.0,5.0
55,5.0,18 days,Less than 2 months,Flum Vape,Awesome product. Love it,5.0,5.0,3.0
56,5.0,18 days,Less than 2 months,My fav,Best hit,4.0,4.0,4.0
57,5.0,18 days,Less than 2 months,Great!,Amazing.,5.0,5.0,5.0
58,5.0,19 days,Less than 2 months,Good,Excellent taste,5.0,5.0,5.0
59,5.0,19 days,Less than 2 months,Aloe Mango Melon Ice,"favorite flavor so far, always on point with the taste and I feel like these last more than the others.",5.0,4.0,4.0
60,5.0,19 days,Less than 2 months,Excellent,"Great product, great price. 🥰🥰🥰",5.0,5.0,5.0
61,5.0,19 days,Less than 2 months,Great Product,"Great product, last long and doesn't get oil in mouth.",4.0,4.0,4.0
62,5.0,19 days,Less than 2 months,Strawberry banana flum,Love the service! Fast and very satisfying.,5.0,5.0,4.0
63,5.0,19 days,Less than 2 months,Best flavors,It last for a while without the recharge option and the flavors are much better,5.0,2.0,4.0
64,5.0,19 days,Less than 2 months,Lichi Rosy,"Not as sweet as most of the other fruity flavors, but still good. You can definitely taste the lichi.",3.0,3.0,4.0
65,5.0,19 days,Less than 2 months,Flum,Good flavor,5.0,5.0,5.0
66,5.0,20 days,Less than 2 months,Tasty,Love it!,5.0,4.0,4.0
67,5.0,20 days,Less than 2 months,Good,Smooth and nice,4.0,2.0,5.0
68,4.0,20 days,Less than 2 months,Yym,So good!,5.0,5.0,3.0
69,1.0,20 days,Less than 2 months,Strawberry ice cream,I like flum disposables but this flavor was not it. It basically taste like it had actually dairy in it and like i was vaping rotten milk.,1.0,1.0,4.0
70,3.0,20 days,Less than 2 months,Not that great,Goes out fast,3.0,3.0,1.0
71,5.0,20 days,Less than 2 months,Good,Good,5.0,5.0,5.0
72,5.0,20 days,Less than 2 months,Convenient and easy to use,"This is a great convenience product because it doesn't have to be charged (no risk of change to flavor from charging) and the battery really lasts forever. I like certain flavors more than others but it could just be personal preference. I like Litchi Rosy, Melon Ice Cream, and Peach Ice. Cotton Candy is alright but not the most flavorful. I did not like Strawberry Ice Cream very much but it was still good enough to finish.",4.0,4.0,5.0
73,5.0,20 days,Less than 2 months,Super fast!,Super fast shipping!,5.0,5.0,4.0
74,4.0,20 days,Less than 2 months,Love,Nice clouds,5.0,4.0,4.0
75,3.0,20 days,Less than 2 months,Good,Can't go wrong with Flum,5.0,4.0,4.0
76,5.0,20 days,Less than 2 months,Peach ice,That cool feeling but not too much with a sweet after flavor,5.0,3.0,5.0
77,5.0,21 days,Less than 2 months,great alternative to smoking,"love them, and great price",5.0,5.0,5.0
78,5.0,21 days,Less than 2 months,Review,This product is very much to my liking!! The quickness of my order was sent & my receiving it was amazing!!,5.0,4.0,5.0
79,5.0,21 days,Less than 2 months,Great flavors!,"Love the variety of flavors, strawberry, watermelon, and juicy apple are my favorites.",5.0,5.0,5.0
80,4.0,21 days,Less than 2 months,Title,They are all good so far,3.0,4.0,3.0
81,5.0,22 days,Less than 2 months,Question nothing,"Perfect
Great flavor variety and service",5.0,5.0,4.0
82,5.0,22 days,Less than 2 months,Just fantastic,"At old locations I would get some capes that would not work, but every flum from huff puffers has been perfect and last as long as needed. Just fantastic",4.0,3.0,5.0
83,5.0,22 days,Less than 2 months,Love them,Love the Flum and Huff & Puffers was fast and efficient!!,5.0,5.0,5.0
84,5.0,23 days,Less than 2 months,Best,My best vape,5.0,5.0,5.0
85,5.0,23 days,Less than 2 months,Awesome,My favorite disposable vape,5.0,5.0,4.0
86,5.0,23 days,Less than 2 months,Fruity Hawaii,Product came within less then a week from ordering,5.0,5.0,4.0
87,5.0,24 days,Less than 2 months,Here you go,I like it I like the ample flavor,5.0,5.0,5.0
88,5.0,24 days,Less than 2 months,Flum Peach Ice,This has been my favorite flavor for a long time. I usually try to make it last but it’s so good!,5.0,5.0,4.0
89,5.0,25 days,Less than 2 months,My favorite,This flavor seems to be the longest lasting and it’s smooth.,5.0,1.0,5.0
90,2.0,25 days,Less than 2 months,Vape,Nice,5.0,3.0,3.0
91,5.0,25 days,Less than 2 months,New customer,Love it,5.0,5.0,5.0
92,5.0,25 days,Less than 2 months,Cotton candy,My go to flavor!,5.0,5.0,5.0
93,5.0,25 days,Less than 2 months,Good vapes!,These vapes are nice and smooth with excellent flavor.,5.0,3.0,3.0
94,5.0,25 days,Less than 2 months,The one and only,"The only vape I use due to it's strong puffs, flavor and longevity!! Last even longer if you know what you're doing hehe!!",5.0,5.0,5.0
95,5.0,26 days,Less than 2 months,Love the Flavor,My favorite vape pen by far,5.0,3.0,4.0
96,5.0,26 days,Less than 2 months,Float disposal,"Amazing flavor, not to harsh on the draw",5.0,5.0,5.0
97,5.0,26 days,Less than 2 months,Review,Great service,5.0,2.0,3.0
98,5.0,26 days,Less than 2 months,A++,A++,5.0,5.0,5.0
99,5.0,26 days,Less than 2 months,Love it!,It’s so tasty!,5.0,4.0,4.0
100,5.0,26 days,Less than 2 months,Awesome Awesome,I enjoy the vape,5.0,5.0,5.0
101,5.0,26 days,Less than 2 months,Love this website,ships to my house in 2-3 days max and the vapes are never duds like smoke shops in my area.,5.0,3.0,5.0
102,5.0,26 days,Less than 2 months,Sweet and minty,"Sweet and minty, similar to lush ice.",5.0,5.0,5.0
103,5.0,26 days,Less than 2 months,Title,Great,5.0,5.0,5.0
104,5.0,26 days,Less than 2 months,Flum vapes,Lasts long and tasty!,5.0,5.0,5.0
105,5.0,26 days,Less than 2 months,Perfect,Last longer than other vapes and isnt expensive!,5.0,5.0,5.0
106,5.0,26 days,Less than 2 months,Ms,Lasted long for such a small vape,3.0,3.0,5.0
107,5.0,26 days,Less than 2 months,.,This is my favorite flavor,5.0,3.0,4.0
108,5.0,27 days,Less than 2 months,Peach Ice,They are great and they were delivered fast,5.0,5.0,5.0
109,5.0,27 days,Less than 2 months,Love it,"One of the best - having tried various brands and flavors, this one stands out",5.0,4.0,5.0
110,5.0,27 days,Less than 2 months,The best ones,The best and only vapes,5.0,3.0,3.0
111,5.0,27 days,Less than 2 months,Peach Ice,Long lasting - 3 weeks,5.0,5.0,5.0
112,5.0,27 days,Less than 2 months,Green apple 🍏,The best I love them,5.0,4.0,5.0
113,5.0,27 days,Less than 2 months,Good product,I personally like it. Can smoke it anywhere,5.0,5.0,4.0
114,5.0,28 days,Less than 2 months,Cheapest place I could find for these 🙌🏽,"These are great, peach ice is the best flavor IMO, I get at least 7 at a time for free shipping 👍🏼",5.0,5.0,4.0
115,5.0,28 days,Less than 2 months,.,🔥🔥,5.0,4.0,5.0
116,5.0,28 days,Less than 2 months,Very good,I tried it once and I’ve been getting it since,5.0,5.0,5.0
117,3.0,29 days,Less than 2 months,Idk,Flum float usually is good but recently haven't had good experience with aloe Grape,3.0,3.0,3.0
118,5.0,29 days,Less than 2 months,Flum Float Rainbow Skittles,Shipping was fast and easy. Signature is required when delivery is made. Will make future purchases.,5.0,5.0,5.0
119,5.0,29 days,Less than 2 months,I recommend this product,Favorite flavor,5.0,4.0,4.0
120,5.0,29 days,Less than 2 months,Great,Good hits !good menthal taste,2.0,2.0,5.0
121,3.0,29 days,Less than 2 months,Too sweet,Lush ice was too sweet for me,3.0,5.0,5.0
122,5.0,30 days,Less than 2 months,Flum,Like the different variety flavor specially strawberry banana,5.0,4.0,5.0
123,5.0,1 month,Less than 2 months,Strawberry ice cream,I love it !,5.0,5.0,5.0
124,5.0,1 month,Less than 2 months,The Pino is one of my favorite flavors,So smooth!,5.0,3.0,5.0
125,5.0,1 month,Less than 2 months,Love these,"Love these Vapes. My favorite are the Rainbow Skittles and Apple Icy. They’re not so sweet that it gives me headaches or heartburn, lol. Just great flavor",5.0,3.0,5.0
126,5.0,1 month,Less than 2 months,Very good,Liked it,5.0,5.0,5.0
127,3.0,1 month,Less than 2 months,It's good,I like this one but it's not as good as the peach ice and is a little too much aloe flavor for me personally,4.0,2.0,3.0
128,5.0,1 month,Less than 2 months,Blue raspberry ice,Favorite of all time. I keep buying more,5.0,5.0,5.0
129,5.0,1 month,Less than 2 months,Fav vape,This brand of disposable vape is my favorite.,5.0,4.0,4.0
130,5.0,1 month,Less than 2 months,Great Flavor!,This one is great and I really like the flavor.,5.0,4.0,5.0
131,5.0,1 month,Less than 2 months,I like it,Ordered because I cannot find in store. Love this brand,5.0,5.0,5.0
132,5.0,1 month,Less than 2 months,Flum,Very tasteful and last long,5.0,5.0,5.0
133,5.0,1 month,Less than 2 months,Awesome product,The only issue with this product is that some of them mess up and you only get 50 puffs before it's gone,5.0,3.0,3.0
134,5.0,1 month,Less than 2 months,Great,Soo far haven’t had any issues,5.0,5.0,4.0
135,5.0,1 month,Less than 2 months,Lime Romance,Great quality disposable pens. Will most likely purchase again.,5.0,3.0,5.0
136,5.0,1 month,Less than 2 months,Excellent,Excellent,5.0,5.0,5.0
137,4.0,1 month,Less than 2 months,Loved the flavor,Love red bang but puff felt like it wasn’t hitting & towards the end it started leaking from bottom & kept blinking even when it wasn’t being used.,5.0,3.0,3.0
138,5.0,1 month,Less than 2 months,"Great site, legit products, fast shipping",Zero complaints!,5.0,3.0,4.0
139,5.0,1 month,Less than 2 months,Great,So awesome,5.0,5.0,5.0
140,4.0,1 month,Less than 2 months,A favorite,A long time favorite,4.0,4.0,4.0
141,5.0,1 month,Less than 2 months,Very good,This is a solid vape very reliable,5.0,4.0,5.0
142,5.0,1 month,Less than 2 months,Best Mint,"Love these, true mint, no extra flavor.",5.0,1.0,5.0
143,5.0,1 month,Less than 2 months,Happy,Very quick to receive. I will be reordering very soon!,5.0,5.0,5.0
144,5.0,1 month,Less than 2 months,Flum Float,Really like them a lot. It’s nice because there’s no cigarette smoke and smell to deal with.,5.0,5.0,5.0
145,5.0,1 month,Less than 2 months,Great Vape,I always buy these and the shipping is amazingly fast. 🥰,5.0,5.0,5.0
146,5.0,1 month,Less than 2 months,"Great price, FAST shipping.",The shipping is sooooo fast for California I’m so great full to have access to vapes still. Thank you huffers and puffers.,5.0,5.0,5.0
147,5.0,1 month,Less than 2 months,Review,Good product,5.0,5.0,4.0
148,5.0,1 month,Less than 2 months,Love the Strawberry ice cream!,My all time favorite!,5.0,4.0,5.0
149,5.0,1 month,Less than 2 months,Delicious,Awesome product. Super long lasting.,4.0,4.0,4.0
150,5.0,1 month,Less than 2 months,Great,Perfect,5.0,5.0,5.0
151,5.0,1 month,Less than 2 months,Best flavor,Fast easy ordering and delivery.,5.0,5.0,5.0
152,5.0,1 month,Less than 2 months,Better than I expected,I purchased the peach ice flavor and it tastes amazing. It’s like when inhale you taste a peach ring candy with an ending of cool mint. Literally the best flavor ever! And it came so quickly. I ordered them Saturday and here by Tuesday or Wednesday. I like how prompt and fast the shipping was. Definitely found a great reliable place to purchase these.,5.0,5.0,5.0
153,2.0,1 month,Less than 2 months,Bad,Taste a little different then what I am use to,3.0,4.0,3.0
154,3.0,1 month,Less than 2 months,Good Flavor; Didn’t last long,"Good flavor, but did not last very long.",4.0,4.0,3.0
155,5.0,1 month,Less than 2 months,Great Disposable,Definitely worth it,4.0,5.0,5.0
156,5.0,1 month,Less than 2 months,Delicious!,Great long lasting flavor!,5.0,5.0,5.0
157,5.0,1 month,Less than 2 months,Great product,"I had gotten the cool mint one. And after several months of not having a flavored vape, it was nice to go back to a mint one which I liked prior to them getting rid of it here in California. Shipping was fast and will be ordering again.",5.0,5.0,4.0
158,5.0,1 month,Less than 2 months,Good,Thanks,5.0,5.0,5.0
159,5.0,1 month,Less than 2 months,My favorite,Great taste lasts 2-3 days.,5.0,4.0,5.0
160,5.0,1 month,Less than 2 months,Grape Aloe,"Easy to use. Smooth taste, not too sweet. Perfect blend",5.0,3.0,5.0
161,5.0,1 month,Less than 2 months,Great site with quality products,Bom dot com.,5.0,5.0,5.0
162,5.0,1 month,Less than 2 months,Happy,"I got my vapes the next day, so happy",5.0,3.0,5.0
163,3.0,1 month,Less than 2 months,Strawberry,"Doesn't last very long flavor okay, and is not as strong as the rubber ones!",3.0,3.0,2.0
164,5.0,1 month,Less than 2 months,Bomb,Love it,5.0,5.0,5.0
165,5.0,1 month,Less than 2 months,Dan,Service was great and shipment was fast,5.0,5.0,5.0
166,5.0,1 month,Less than 2 months,Best one I’ve tried,Better then juuls,5.0,2.0,5.0
167,5.0,1 month,Less than 2 months,Works great!,Flavor is different but I like it!,4.0,4.0,5.0
168,5.0,1 month,Less than 2 months,Amazing Flavor and Product,Great flavor! Great service!! Highly recommend Huff & Puffers products. Thank you!,5.0,4.0,5.0
169,5.0,1 month,Less than 2 months,Flum Float,I like it,4.0,2.0,2.0
170,4.0,1 month,Less than 2 months,Cool mint flum,Easy checkout with very quick delivery. The cool mint flum on the other hand had an unusual flavor.,3.0,1.0,5.0
171,5.0,1 month,Less than 2 months,My favorite,It's the one I always go to. I have tried others and other flavors but I still go back to the same brand and same flavor. I have even tried other brands with the same flavor and it's just not the same.,5.0,5.0,5.0
172,5.0,1 month,Less than 2 months,Cool,The flavor is cool and refreshing,5.0,4.0,5.0
173,5.0,1 month,Less than 2 months,Flum,"I am a big fan of the flum disponible vape pens. I enjoy all the flavors and they last quite a good while and have a nice pull of vapor. Very convenient as well. They don’t leave your hand or breath smelling, one of the best parts. Discrete and not offensive in public.
Aloe grape is a fun combo the aloe mellows the fun fruit of the grape.",5.0,4.0,4.0
174,5.0,1 month,Less than 2 months,Good,Woul order again,5.0,3.0,5.0
175,5.0,1 month,Less than 2 months,Flum Float Disposable Vape,One of the best smooth hits!,5.0,2.0,5.0
176,5.0,1 month,Less than 2 months,Great Experience,"Awesome experience, super fast shipping, easy, fast and convenient. Will be ordering again soon!",5.0,5.0,5.0
177,5.0,1 month,Less than 2 months,Flum vapes,Flum is my favorite brand of vapes out there. Flavor and smoke production is really satisfying. I highly recommend!,5.0,5.0,5.0
178,5.0,1 month,Less than 2 months,Product,They last longer than most vapes and have a great flavor,5.0,5.0,5.0
179,1.0,1 month,Less than 2 months,Tobacco cream,Did not like this one. Smell and taste was horrible.,1.0,1.0,4.0
180,5.0,1 month,Less than 2 months,Great,Worth every penny,5.0,5.0,3.0
181,5.0,1 month,Less than 2 months,Menthol,Loved the taste,5.0,4.0,3.0
182,5.0,1 month,Less than 2 months,Clear,Love it. Just the right amount to get me through a craving.,5.0,3.0,5.0
183,5.0,1 month,Less than 2 months,Fast shipping,Came super fast,5.0,2.0,5.0
184,5.0,1 month,Less than 2 months,Lasted,Lasted longer than flum floats normally do for us and shipped super fast,5.0,3.0,5.0
185,5.0,1 month,Less than 2 months,Rainbow skittle,Great!,5.0,5.0,5.0
186,1.0,1 month,Less than 2 months,Review,Didn't like the flavor,2.0,1.0,1.0
187,5.0,1 month,Less than 2 months,Glad I Can Order!,"I really enjoy the cool mint, my favorite!",5.0,5.0,4.0
188,5.0,1 month,Less than 2 months,Great product & fast delivery,Great product and fast delivery. Got my order within a few days.,5.0,5.0,5.0
189,5.0,1 month,Less than 2 months,Good flavor,"I like this flavor, lasts long as well.",5.0,5.0,5.0
190,5.0,1 month,Less than 2 months,Favorite,Best one yet!,5.0,5.0,5.0
191,5.0,1 month,Less than 2 months,Love them,Helped my to stop smoking cigarettes,5.0,3.0,4.0
192,5.0,1 month,Less than 2 months,Excelente Service,Love it!!,5.0,5.0,5.0
193,5.0,1 month,Less than 2 months,Very Smooth,Great flavor and smooth.,5.0,4.0,4.0
194,4.0,1 month,Less than 2 months,Flum,Enjoyable,4.0,3.0,3.0
195,5.0,1 month,Less than 2 months,Guava citrus is my favorite,best flavor I have tried so far,5.0,2.0,5.0
196,5.0,1 month,Less than 2 months,Long lasting and easy to use,Love these disposals,5.0,3.0,5.0
197,5.0,1 month,Less than 2 months,Reliable,Flavor is always smooth. Reliable long lasting.,5.0,3.0,5.0
198,5.0,1 month,Less than 2 months,Quality,Enjoyed the product,5.0,5.0,3.0
199,5.0,1 month,Less than 2 months,Strawberry ice cream,"My favorite flavor so far, my go too always.",5.0,5.0,5.0
200,5.0,2 months,Less than 2 months,Summer strawkiwi,My absolute favorite!! Sweet but not too much.,5.0,5.0,5.0
201,5.0,2 months,Less than 2 months,Bomb as always,Great lasted a while,5.0,4.0,5.0
202,5.0,2 months,Less than 2 months,Blue rasp ice,Great. Very fast shipping also.,5.0,5.0,5.0
203,5.0,2 months,Less than 2 months,Puffers,Perfect,4.0,4.0,3.0
204,5.0,2 months,Less than 2 months,Good vape,"Good flavor, hits right every time!",5.0,5.0,5.0
205,5.0,2 months,Less than 2 months,Aloe mango melon ice,One of my favorite flavors,4.0,4.0,4.0
206,5.0,2 months,Less than 2 months,Red bang,"Awesome supplier of our daily needs , I’m a huff and puffer.
Thank you.",5.0,5.0,4.0
207,5.0,2 months,Less than 2 months,Very good,I really enjoyed the flavor and it was a fair price,5.0,5.0,5.0
208,5.0,2 months,Less than 2 months,Great flavor,Great flavor just wish they would last longer without having to buy the rechargeable ones.,4.0,4.0,4.0
209,5.0,2 months,Less than 2 months,fave flavor,amazing!,5.0,4.0,4.0
210,5.0,2 months,Less than 2 months,Best vape for strawberry flavors,Good flavor lasts long and flavor lasts. Doesn't have charging port,5.0,4.0,3.0
211,5.0,2 months,Less than 2 months,Grapes my fav,This is one of my favorite flavors of flums,5.0,5.0,5.0
212,5.0,2 months,Less than 2 months,Vape,Very good tasting.,4.0,4.0,4.0
213,5.0,2 months,Less than 2 months,Great vape,Great vape. No need to worry about charging. Lasted me about 2 weeks,5.0,4.0,4.0
214,5.0,2 months,Less than 2 months,Always solid,"Delivered as expected, timely. Will order again",4.0,1.0,4.0
215,5.0,2 months,Less than 2 months,Very nice!,👍👍👍👍,5.0,4.0,5.0
216,5.0,2 months,Less than 2 months,Love !,These things are the best - they last a long time and the price is right :),5.0,5.0,5.0
217,5.0,2 months,Less than 2 months,Great,It's my favorite and it tastes so good,5.0,5.0,4.0
218,5.0,2 months,Less than 2 months,Aloe mango melon ice,My favorite,5.0,5.0,5.0
219,5.0,2 months,Less than 2 months,The best,Strong flavor from start to finish.,5.0,4.0,5.0
220,4.0,2 months,Less than 2 months,good,very good,5.0,5.0,5.0
221,5.0,2 months,Less than 2 months,Best flavor,Aloe Mango Melon Ice is the best! It’s mellow and not too sweet.,5.0,3.0,5.0
222,5.0,2 months,Less than 2 months,Excellent service! Shipping is fast and product is high quality!,Great flavor and quality devices. By far my favorite!,5.0,4.0,4.0
223,5.0,2 months,Less than 2 months,Delicious,By far one the better vapes I’ve had,4.0,4.0,4.0
224,5.0,2 months,Less than 2 months,one of their best flavors,"...in my opinion, that is",5.0,4.0,5.0
225,5.0,2 months,Less than 2 months,flum disposable,good vape,4.0,4.0,5.0
226,5.0,2 months,Less than 2 months,can never go wrong with flum disposables,and this shop doesn't overcharge for them. as compared to another shop I was at that was selling them for $20+,4.0,4.0,5.0
227,5.0,2 months,Less than 2 months,Also mango melon ice,Good price and great flavor,5.0,4.0,5.0
228,5.0,2 months,Less than 2 months,Smells good,Smell good,5.0,5.0,5.0
229,5.0,2 months,Less than 2 months,Flum,Can go wrong with a flum disposable. 1st time front the strawberry watermelon float. Will definitely buy again,5.0,5.0,5.0
