Review_id,Ratings,Dates,Date_Category,Heads,Texts,Flavor,Sweet,Lasting
565,5.0,1 year,Less than 2 months,Fave flavor,This is my favorite flavor! Super smooth and minty sweet,,,
566,5.0,1 year,Less than 2 months,New flavor!,Hits nice!,,,
567,5.0,1 year,Less than 2 months,Vape pin,"Product worked great. Fast delivery. Exalent
service",,,
568,4.0,1 year,Less than 2 months,Good,I liked it,,,
569,5.0,1 year,Less than 2 months,Nice,Taste just like banana! Loved it!,,,
570,5.0,1 year,Less than 2 months,Best ones,Tried a bunch of others- won't get any other kind anymore.,,,
571,5.0,1 year,Less than 2 months,Best vape,"This is the best disposable vape pen I have come across. All the others either leak, are broken, or doesn't work properly. Highly recommend. Also, a lot of flavors.",,,
572,5.0,1 year,Less than 2 months,These are my favorite,"Good price on these Max Flow vapes, which are my favorite. I really loved that they came next day!",,,
573,5.0,1 year,Less than 2 months,Hyppe is my go 2..,Quit cigs n May. Started off w Hyppe and continued. The shipping w Huff n Puff is TWO DAYS..AWESOME..THANKS GUYS,,,
574,5.0,1 year,Less than 2 months,Good,lasts for days and is easy to use. also great pricing,,,
575,5.0,1 year,Less than 2 months,Easy Transition from Cigs,"I started vaping to get off a 50 year cigarette addiction. I found the Max Flow Naked came closest to a cigarette experience. Then I discovered the Cotton Clouds Max Flow which has become my favorite. It's a cleaner smoke than cigs. I don't cough any more, nor do I get congested. Plus, no ashes, no butts, no ashtrays. Plus, it doesn't smell up the house. Love the Max Flow.",,,
576,5.0,1 year,Less than 2 months,Love this vape,Cheap and easy to use. Only bad thing it only lasts 2 days. Besides solid product.,,,
577,5.0,1 year,Less than 2 months,Replacement,Very nice introduce by my son on a golfing day. Bought one and it was defective and huff and puff replaced it!,,,
578,5.0,1 year,Less than 2 months,Great product,Great Flavor,,,
579,5.0,1 year,Less than 2 months,Excellent Flavor,This is the best minty vape flavor!,,,
580,5.0,1 year,Less than 2 months,Good Brand,I like the freeze flavor,,,
581,5.0,1 year,Less than 2 months,Great,Great,,,
582,1.0,1 year,Less than 2 months,Not great,Not great,,,
583,5.0,1 year,Less than 2 months,Best customer service I've had in the pandemic,"Ok, the vapes almost all were amazing. I reached out however about a couple that were just not ""hitting"" like the others. They emailed me back within a couple hours saying they would send replacement pods asap. True to their word they were shipped within 24 hours and worked phenomenally. I highly appreciate the people at the company and it shows that dealing with mom and pop shops truly pays off.",,,
584,5.0,1 year,Less than 2 months,Great product,"Love the variety to choose from. Lasts a long time and is very compact, not bulky at all. Love Cola Ice & Chewy Watermelon",,,
585,5.0,1 year,Less than 2 months,Most helpful staff!,A great experience all around - and the most helpful staff I've ever experienced,,,
586,5.0,1 year,Less than 2 months,Great,Would buy again,,,
587,5.0,1 year,Less than 2 months,Favorite flavor,Great flavor with refreshing mint with every hit,,,
588,5.0,1 year,Less than 2 months,(:,These are super smooth and the flavors are delicious!,,,
589,5.0,1 year,Less than 2 months,Good store with good price,Compared to other store Huff and Puffers giving you a steal deal. I only pay $18 for Hyppe max flow while other store I bought was $28. Highly recommend this store,,,
590,5.0,1 year,Less than 2 months,Love it,Love the vape with great choice of flavors,,,
591,5.0,1 year,Less than 2 months,Hyppe is the best,Actually I’m very happy buying the Hyppe vapes all the flavors are so good 😊,,,
592,4.0,1 year,Less than 2 months,Good Device,Lasts a good amount of time. I got the lush flavor and didn’t really like it much but it has good airflow and gets the job done.,,,
593,5.0,1 year,Less than 2 months,One of my favorites,This taste like Bang which I love!,,,
594,4.0,1 year,Less than 2 months,convenient,"this disposables will give you what you are looking for, good flavor and a great vaping felling. the batterie life doesn't last too much but it get the job done, just make sure you get the supreme version. I will recommend you to get the smoke acro you gonna save money !",,,
595,5.0,1 year,Less than 2 months,Hyppe Vape Disposable Pen,It is slim and light weight . Nice soft feel to it . Easy fit in pockets and purses. A lot of tasty flavors to choose from. Tried many other brands and this is my favorite.,,,
596,5.0,1 year,Less than 2 months,Good vape,The flavor and the smoke,,,
597,5.0,1 year,Less than 2 months,Great product from a great shop,"The cola flavor i got is really good, it tastes just like Coca Cola.",,,
598,5.0,1 year,Less than 2 months,Yum yum,"Long lasting, great brand! I love the cola ice flavor, taste like a real refreshing coke, it satisfies my sweet teeth craving.",,,
599,5.0,1 year,Less than 2 months,Fantastic,Flavor was good and smoked at your own level of air.,,,
600,4.0,1 year,Less than 2 months,Good,Would buy again,,,
601,4.0,1 year,Less than 2 months,Good,Would buy again,,,
602,4.0,1 year,Less than 2 months,Good,Would buy again,,,
603,4.0,1 year,Less than 2 months,Pretty good,Smooth,,,
604,4.0,1 year,Less than 2 months,Good flavor,Doesn’t seem to last as long as smaller devices . Battery ran out before flavor. But good while it lasted,,,
605,5.0,1 year,Less than 2 months,Best disposable I have found,"Best disposable vape I have found thus far. Finally help me quit cigarettes. Tried it all blu, juel, puff none of them were enough to make me quit. But the hype supreme finally did it!",,,
606,5.0,1 year,Less than 2 months,My new to go to flavor,Love this flavor,,,
607,5.0,1 year,Less than 2 months,Hype pen,Great smooth hit excellent product,,,
608,5.0,1 year,Less than 2 months,These are awesome!,I love these they are legit. The flavors are soo good and they are at a decent price.,,,
609,5.0,1 year,Less than 2 months,Smooth and great flavor,The pull was nice and smooth and the flavor was great!,,,
610,5.0,1 year,Less than 2 months,Tastes great and lasts,This product is great the taste is always consistent and it lasts fairly long depending on how often and individual smokes.,,,
611,4.0,1 year,Less than 2 months,😁,👍,,,
612,5.0,1 year,Less than 2 months,I like the taste,I don’t smoke as much and My clothes don’t have that horrible smell of smoke.,,,
613,4.0,1 year,Less than 2 months,Great Flavor,Hits are perfect with great flavor. Just wished they lasted longer. Aloe grape and lush ice are the best.,,,
614,5.0,1 year,Less than 2 months,Hyppe,Works great,,,
615,5.0,1 year,Less than 2 months,Hype,Hype max flow are good,,,
616,5.0,1 year,Less than 2 months,Smooth and lasting,I like the cola one. Smooth and lasting flavor.,,,
617,5.0,1 year,Less than 2 months,Quality,Quality,,,
618,5.0,1 year,Less than 2 months,Great lifespan and flavor,I've found that this brand really holds up to the 2500 (around there I believe?) puffs and lasts me quite a while. Cucumber berry is also my favorite flavor so I would definitely back this flavor in addition to the brand and its lifespan,,,
619,5.0,1 year,Less than 2 months,Hyppe,Surprised with the great flavor very bold would buy again,,,
620,5.0,1 year,Less than 2 months,Lasts for a while,Great flavor and lasts about a week,,,
621,5.0,1 year,Less than 2 months,I like how I could adjust the drag,Great being able to adjust the flow,,,
622,5.0,1 year,Less than 2 months,Great,Great flavor,,,
623,5.0,1 year,Less than 2 months,I like the flavor,I like the flavor and how it is disposable,,,
624,5.0,1 year,Less than 2 months,Hyppe supreme max,Excellent product I love this brand,,,
625,5.0,1 year,Less than 2 months,Review,Love this flavor 😋,,,
626,5.0,1 year,Less than 2 months,Max flow fiyaa :),Its fiyaaaaaa :),,,
627,5.0,1 year,Less than 2 months,Review,A must buy !!,,,
628,5.0,1 year,Less than 2 months,Vaping rewards,Favorite brand of vaping,,,
629,5.0,1 year,Less than 2 months,Max flow fiyaa :),My favorite go to for vaping!,,,
630,5.0,1 year,Less than 2 months,Great Service & Quick Delivery. Exactly what I was looking for!,"I liked everything about this whole process. Great price, easy to purchase, quick delivery, and got exactly what I ordered!",,,
631,4.0,1 year,Less than 2 months,Hyppe,Good flavor,,,
632,5.0,1 year,Less than 2 months,I love it,My favorite flavor,,,
633,5.0,1 year,Less than 2 months,Great taste,Good flow and flavor,,,
634,5.0,1 year,Less than 2 months,Killer price on a good vape,"Smooth, great flavor, lasts as long as expected",,,
635,5.0,1 year,Less than 2 months,Love it!,Finally found a flavor that I love and has a smooth taste and the flow is amazing.,,,
636,3.0,1 year,Less than 2 months,Nice clouds,These vapes produce pretty good clouds. Mint is lacking in flavor and is a bit dull,,,
637,5.0,1 year,Less than 2 months,Exactly what I ordered and delivered quick,"These were exactly what I ordered, because I couldn’t find them anymore at our local stores. They were delivered quickly. So happy I found them!!",,,
638,5.0,1 year,Less than 2 months,Love my Hyppe Maxflow,Love the Hyppe Maxflow peach! Great product and service.,,,
639,5.0,1 year,Less than 2 months,Great product,Has a good flow and smooth taste. Definitely my fav of them all,,,
640,5.0,1 year,Less than 2 months,"Nice flavor, sweet icey",Love being able to adjust the flow!,,,
641,5.0,1 year,Less than 2 months,Great Taste,This brand always has great flavors.,,,
642,5.0,1 year,Less than 2 months,Amazing,"All of the flavors are great, I’ve had one or two duds but the store is great with exchanging them. Appreciate the selection and the prices!",,,
643,5.0,1 year,Less than 2 months,My all time Fav,"Obsessed with the Gummy Teddy, it’s my favorite but definitely depends on what flavor you like. Long lasting and hits great.",,,
644,5.0,1 year,Less than 2 months,Excellent,My experience with my online purchase was great! Shipping was super fast. Definitely purchasing again,,,
645,4.0,1 year,Less than 2 months,Good Flavors,I ordered from HP because my original order from another company was totally messed up. Anyway I like the variety of flavors offered. The Lush Ice was great!! I got my order w/in 2 days. Loved it. Will order again from them.,,,
646,5.0,1 year,Less than 2 months,Great Value,"Quality products, speedy shipping.",,,
647,5.0,1 year,Less than 2 months,Love this product,I love this product helped me quit smoking cigarettes.,,,
648,5.0,1 year,Less than 2 months,Great price,I used to buy these at my local tobacco shop at $20 plus tax each. I get them on Huff and Puffers for $16 each after tax. Definitely buying here from now on!!,,,
649,4.0,1 year,Less than 2 months,Very good,Everything went well.,,,
650,5.0,1 year,Less than 2 months,Great Price,Excellent service and quick shipping,,,
651,5.0,1 year,Less than 2 months,Great pricing!,"This is my favorite product and their pricing is about $5 less than where I normally purchase. Quick shipping, too!",,,
652,5.0,1 year,Less than 2 months,Good disposable,These are so convenient,,,
653,5.0,1 year,Less than 2 months,Love these,These are great,,,
654,5.0,1 year,Less than 2 months,Great,These are my go to!,,,
655,5.0,1 year,Less than 2 months,Awesome,These are my favorite disposables!,,,
656,5.0,1 year,Less than 2 months,Yum!,These are so tasty!,,,
657,5.0,1 year,Less than 2 months,Satisfied,I really like the Hype Max Flow. I would definitely recommend this.,,,
658,5.0,1 year,Less than 2 months,Great,Great,,,
659,5.0,1 year,Less than 2 months,Tastes great,I have purchased many flavors which all I enjoy. The prices are great as well and will keep ordering from them as I have many more flavors to try. Definitely suggest ordering from them as you will save lots of money and they deliver fast.,,,
660,5.0,1 year,Less than 2 months,Awesome!!,Tastes great and lasts for sure!!!!,,,
661,5.0,1 year,Less than 2 months,Great taste,I love these vapes,,,
662,5.0,1 year,Less than 2 months,Great,Awesome,,,
663,5.0,1 year,Less than 2 months,Will buy over & over !!,"This company once again exceeded my expectations. I ordered my vapes & it took literally from start to finish only 3 days ( they came from West coast to East coast ) will def be ordering again & again. Btw, the vape hits smooth & I love the fact you can use either flavor or both at the same time. Enjoy !!!",,,
664,5.0,1 year,Less than 2 months,Satisfied,It’s a great product and I love the flavor. Also received my order within 2 days which is awesome,,,
665,5.0,1 year,Less than 2 months,favorite disposable,"flavor lasts, hits last",,,
666,5.0,1 year,Less than 2 months,solid,"classic disposable, airflow feature is n ice",,,
667,5.0,1 year,Less than 2 months,great airflow,"really like the adjustable airflow, flavor lasted a long time",,,
668,5.0,1 year,Less than 2 months,Excellent,Lasts long and smooth,,,
669,5.0,1 year,Less than 2 months,Amazing,This a great purchase flavor is good and last long,,,
670,4.0,1 year,Less than 2 months,Yummy,This flavor is really good last long too,,,
671,5.0,1 year,Less than 2 months,Smooth,Great last long good flavor smooth,,,
672,5.0,1 year,Less than 2 months,Best of all ecigarettes,Easy peasy smoking,,,
673,5.0,2 years,Longer than 1 year,Great choice,My favorite is Banana Freeze,,,
674,5.0,2 years,Longer than 1 year,Great experience,Very satisfied. Fast delivery and great products.,,,
675,5.0,2 years,Longer than 1 year,Yum,Good flavor,,,
676,5.0,2 years,Longer than 1 year,Great company,Will order again,,,
677,5.0,2 years,Longer than 1 year,Awesome!,Amazing flavor and always quick shipping!,,,
678,5.0,2 years,Longer than 1 year,LOVE IT,Great flavor. Lasts a long time!!,,,
679,5.0,2 years,Longer than 1 year,Hype maxx,Great flavor,,,
680,5.0,2 years,Longer than 1 year,Great,great,,,
681,4.0,2 years,Longer than 1 year,hyppe max,got my order was easy and got here fast ship,,,
682,5.0,2 years,Longer than 1 year,Great service and prompt delivery,Great service and prompt delivery,,,
683,5.0,2 years,Longer than 1 year,Blue Gummy super yummy,Totally smooth and creamy after taste. Really enjoyed the Hyppe disposable Blue Gummy.,,,
684,5.0,2 years,Longer than 1 year,One of my favorite flavors,I started vaping and was obsessed with the Hyppe disposables. Still vape with them sometimes. This (Red Apple Guava) and Gummy Teddy were my favorite flavors.,,,
685,5.0,2 years,Longer than 1 year,Best flavor yet,Such a yummy mix!!,,,
686,5.0,2 years,Longer than 1 year,Hyppe,"HANDS DOWN, my favorite vape brand! I love the lush and mint, it hits really good each time and the flavor is on point!",,,
687,5.0,2 years,Longer than 1 year,great,n/a,,,
688,5.0,2 years,Longer than 1 year,Great,Super fast delivery and products worked fine,,,
689,5.0,2 years,Longer than 1 year,decent flavor,good brand that produces tasty flavors,,,
690,5.0,2 years,Longer than 1 year,Great flow,Flavor was good,,,
691,5.0,2 years,Longer than 1 year,Satisfied,Loved the flavors,,,
692,5.0,2 years,Longer than 1 year,Hyppe Max Flow Disposable Vape 5% Nicotine,I think it’s a great product. It’s smooth and The flavors are not harsh like other vapes I’ve used in the past. I also love the variety of flavors. Hope to see the Hyppe Max Flow DUO on huff and puffers soon. This is a great product!,,,
693,5.0,2 years,Longer than 1 year,Great product,"I never liked vaping before I was introduced to this product. I tried a few flavors but strawberry gummy is my favorite. It’s smooth, smells good, not strong. Shipping to my residence is 3 days and comes packaged nicely. Great product.",,,
694,5.0,2 years,Longer than 1 year,Fast shipping great product,Happy with purchase thank you,,,
695,5.0,2 years,Longer than 1 year,Great flavor,"I normally don't like banana, but this is really good.",,,
696,5.0,2 years,Longer than 1 year,Loved it,Girlfriend wanted to try a new flavor and she loved it,,,
697,5.0,2 years,Longer than 1 year,Great product,Best disposable e-cigarettes,,,
698,5.0,2 years,Longer than 1 year,Excellent Product,I love the flavour and it lasts a bonkers amount of time.,,,
699,5.0,2 years,Longer than 1 year,Good product,Good product,,,
700,5.0,2 years,Longer than 1 year,Will be ordering again,First time ordering from here Delivery was fast.,,,
701,5.0,2 years,Longer than 1 year,"yummy, long lasting",I love hyppe's superior flavors,,,
702,5.0,2 years,Longer than 1 year,Best vape,I've ordered many brands of disposable vapes. Like to have a variety and options. I ordered the raspberry watermelon flavor and was pretty satisfied. The flavor was pretty good and the vape lasted longer than other vapes I have ordered in the past.,,,
703,5.0,2 years,Longer than 1 year,Wonderful product and fast shipping.,Wonderful taste; a really smooth hit and just great flavor.,,,
704,5.0,2 years,Longer than 1 year,THE best!,"Honestly scared to leave this review as I don’t want these selling out. The payment process is easy, good pricing, and they ship quick!",,,
705,5.0,2 years,Longer than 1 year,Love it!,Absolutely love this!!,,,
706,4.0,2 years,Longer than 1 year,Good,Long lasting,,,
707,4.0,2 years,Longer than 1 year,Good Product. Long Wait for Delivery,Everything showed up just as I ordered and well packaged. Took over a week coming from California to California.,,,
708,5.0,2 years,Longer than 1 year,Hyppe strawberry watermelon apple,Strawberry watermelon apple hyppe disposable vape is the best I’ve ever had. Great product. I wish they had this exact flavor in liquid.,,,
709,4.0,2 years,Longer than 1 year,Ok,"Ok, flavor not as great",,,
710,5.0,2 years,Longer than 1 year,Great Vape,"I like that I get more than 2 days out of these, and the price compared to buying these locally.",,,
711,5.0,2 years,Longer than 1 year,Best disposable yet!,"I absolutely love these and almost every flavor I’ve tried. Of course there are different flavors that will appeal to anyone. I love all of the tropical flavors. The fact that you can control your puff strength is genius. I’m a previous smoker of almost 15yrs and thought I’d never be able to quit successfully. These have been life changing. Obviously smoking nothing would be ideal, but I’m not even close to that yet. I don’t stink anymore lol, they’re cheaper than cigarettes now, and taste a hell of a lot better. Personally this brand and type actually resemble the effect of smoking as far as the drag strength and “rush” go, although I am smoking way less than I ever smoked cigs. These are hands down the best disposable I’ve tried, I will continue to buy these! Not to mention the shipping is super quick, so definite added bonus :)",,,
712,5.0,2 years,Longer than 1 year,Watermelon Ice is the best!,"I almost don’t want to write this for fear of it selling out, but one of my absolute favorite!",,,
713,5.0,2 years,Longer than 1 year,Lush Freeze!,"I switch between XTRA Lush /Lush Fusion and this. By far my two favorite flavors, and I’ve literally tried at least 40-50! And as always H&P is my go to for vape products!",,,
714,4.0,2 years,Longer than 1 year,Nice,Great flavor,,,
715,5.0,2 years,Longer than 1 year,BEST FLAvOR EVER!,This was the first vape I ever tried l love it so much I order more than one every time! All of my friends love this one too. Also this site has super fast delivery.I am down to one cigarette a night most of the time Also love Banana ice that my friend let me try: Getting my own son😜,,,
716,5.0,2 years,Longer than 1 year,Worth the money,A lot cheaper then in store and flavor is great,,,
717,5.0,2 years,Longer than 1 year,Love it,Awesome will keep buying,,,
718,5.0,2 years,Longer than 1 year,Great product,Great-tasting vapor or something that is easy-to-use. Perfect alternative to replace smoking cigarettes.,,,
719,5.0,2 years,Longer than 1 year,No Complaints,"Good Price, Fast Delivery, Quick and easy. Love it!",,,
720,5.0,2 years,Longer than 1 year,Fantastic,Love these. I quit smoking cigarettes using these vape pens entirely!!!,,,
721,5.0,2 years,Longer than 1 year,Disposable vape,"Great product...I wouldn't have been able to quit cigarettes without these!!
Great service and product arrives quickly and packaging is excellent!😊",,,
722,5.0,2 years,Longer than 1 year,Just what I wanted,Really like the adjustment that can be made on the bottom. Great hit and great flavor.,,,
723,5.0,2 years,Longer than 1 year,10/10,10/10,,,
724,5.0,2 years,Longer than 1 year,10/10,Great,,,
725,5.0,2 years,Longer than 1 year,Amazing,Would recommend,,,
726,5.0,2 years,Longer than 1 year,Excellent,Always what I want and fast shipping,,,
727,5.0,2 years,Longer than 1 year,Nice flavor,easy to carry around and last a long time,,,
728,4.0,2 years,Longer than 1 year,Very pleasant experience,I like the adjustable flow settings on the bottom.,,,
729,5.0,2 years,Longer than 1 year,Hyppe max flow,"I love this product, I've tried others but to me this one is the best. This company is also #1, I use to order from a different seller and my package almost always was either lost or received it 4 weeks late. This is the best company by far!!",,,
730,5.0,2 years,Longer than 1 year,Enjoying the flavors,Love the variety of flavors.,,,
731,5.0,2 years,Longer than 1 year,Excellent Vape,HYPPE MAX FLOW is the best disposable vape by far!,,,
732,5.0,2 years,Longer than 1 year,Favorite,One of the best flavors!,,,
733,5.0,2 years,Longer than 1 year,I like it!,Switch over from puff xtra. Last longer for sure and i like how you can adjust the air flow.,,,
734,5.0,2 years,Longer than 1 year,Great flavor,Lush is one of the best flavor for this pod. Would recommend,,,
735,5.0,2 years,Longer than 1 year,nice product,I have ordered these before from another company and they were NOT the real thing and could not get my money back.,,,
736,5.0,2 years,Longer than 1 year,Best disposable vape I’ve found,The flavor of this one is awesome and with the adjustable air flow can get the perfect puff,,,
737,5.0,2 years,Longer than 1 year,Love it,Lasts a long time and great flavor.,,,
738,5.0,2 years,Longer than 1 year,Satisfied Customer,Delivery was fast and accurate. Product worked well plan on placing another order.,,,
739,4.0,2 years,Longer than 1 year,"Decent flavor, lasts a good amount of time","This vape is good at actually lasting. I’ve tried other ones that say they have the same number of puffs but run out in 3/4 days. These ones last me about a week. The only thing I don’t love about these vapes is that the flavors are meh but if you choose the right ones, they’re not bad.",,,
740,5.0,2 years,Longer than 1 year,Yummy,This flavor is great and it lasts a long time!,,,
741,5.0,2 years,Longer than 1 year,Solid,Seems like they give you the most puffs out of any.,,,
742,5.0,2 years,Longer than 1 year,Tasty and Satisfying,Tasty and Satisfying.,,,
743,4.0,2 years,Longer than 1 year,Not bad but not the best,"To each there own, my fiance loves the flavor but im in not in love with it",,,
744,5.0,2 years,Longer than 1 year,Hyppe Plus,The lush freeze is definitely my favorite flavor. Will continue to buy this product for sure,,,
745,5.0,2 years,Longer than 1 year,Good,Very good tasting,,,
746,5.0,2 years,Longer than 1 year,Love it,It’s helped me to stop smoking,,,
747,5.0,2 years,Longer than 1 year,My wife’s fav,Great taste. Best air flow adjustment you can find.,,,
748,5.0,2 years,Longer than 1 year,Highly recommended,"Product is great, and they ship the product very fast. Great customer service as well.",,,
749,5.0,2 years,Longer than 1 year,Max flow,Great flavor..,,,
750,4.0,2 years,Longer than 1 year,On time delivery and had all of the product I ordered.,"The flavors are good and most of the products worked good except for the Cola. It was about 30 or 35 puffs for the Cola, and the flavor good, but then hard to get a draw form the device unlike the other flavor types and they don't last very long.",,,
751,5.0,2 years,Longer than 1 year,Love the twist,"Love the minty ones. Customer service is great, delivery is fast.",,,
752,5.0,2 years,Longer than 1 year,Great,Great hits. Great flavor. Definitely a go-to.,,,
753,5.0,2 years,Longer than 1 year,Great experience,Quick arrival! Great quality!,,,
754,5.0,2 years,Longer than 1 year,Review,Only ones I like,,,
755,5.0,2 years,Longer than 1 year,Hyppe Max Flow,Great product best vape on the market long lasting and great flavor,,,
756,5.0,2 years,Longer than 1 year,Flavor is amazing!,"Tried a bunch of the flavors, but Banana Ice is by far my favorite!!",,,
757,5.0,2 years,Longer than 1 year,Love it,This item is portable and the flavors are extraordinary. Love it. Purchasing more.,,,
758,4.0,2 years,Longer than 1 year,Good,Good flavor and draw,,,
759,5.0,2 years,Longer than 1 year,Great vape,Last long time reduced craving for cigarettes,,,
760,5.0,2 years,Longer than 1 year,Customer,The best customer service and the best prices just started a few weeks ago from this company I receive my purchase the next day and will only purchase from this company,,,
761,5.0,2 years,Longer than 1 year,Great vapes,"Gummy teddy tastes like cereal milk and watermelon peach pear has a bad aftertaste, watermelon raspberry and strawberry banana are great. They last longer than any disposable vape I’ve tried",,,
762,5.0,2 years,Longer than 1 year,Tasty,"Tastes just like watermelon gum, I love it",,,
763,5.0,2 years,Longer than 1 year,Coke flavor,"Smell great with mint could make you stun 5 second, but I need more smoke than usual",,,
764,5.0,2 years,Longer than 1 year,Good flavor.,Tastes pretty good. Ordered this one and the mighty mint. Both are great.,,,
765,5.0,2 years,Longer than 1 year,Long lasting,Great taste and great customer service,,,
766,5.0,2 years,Longer than 1 year,GREAT,excellent flavor,,,
767,5.0,2 years,Longer than 1 year,Love,These are my favee. Adjustable flow,,,
