Review_id,Ratings,Heads,Texts,Flavor,Sweet,Lasting
734,4.0,"Decent flavor, lasts a good amount of time","This vape is good at actually lasting. I’ve tried other ones that say they have the same number of puffs but run out in 3/4 days. These ones last me about a week. The only thing I don’t love about these vapes is that the flavors are meh but if you choose the right ones, they’re not bad.",,,
735,5.0,Yummy,This flavor is great and it lasts a long time!,,,
736,5.0,Solid,Seems like they give you the most puffs out of any.,,,
737,5.0,Tasty and Satisfying,Tasty and Satisfying.,,,
738,4.0,Not bad but not the best,"To each there own, my fiance loves the flavor but im in not in love with it",,,
739,5.0,Hyppe Plus,The lush freeze is definitely my favorite flavor. Will continue to buy this product for sure,,,
740,5.0,Good,Very good tasting,,,
741,5.0,Love it,It’s helped me to stop smoking,,,
742,5.0,My wife’s fav,Great taste. Best air flow adjustment you can find.,,,
743,5.0,Highly recommended,"Product is great, and they ship the product very fast. Great customer service as well.",,,
744,5.0,Max flow,Great flavor..,,,
745,4.0,On time delivery and had all of the product I ordered.,"The flavors are good and most of the products worked good except for the Cola. It was about 30 or 35 puffs for the Cola, and the flavor good, but then hard to get a draw form the device unlike the other flavor types and they don't last very long.",,,
746,5.0,Love the twist,"Love the minty ones. Customer service is great, delivery is fast.",,,
747,5.0,Great,Great hits. Great flavor. Definitely a go-to.,,,
748,5.0,Great experience,Quick arrival! Great quality!,,,
749,5.0,Review,Only ones I like,,,
750,5.0,Hyppe Max Flow,Great product best vape on the market long lasting and great flavor,,,
751,5.0,Flavor is amazing!,"Tried a bunch of the flavors, but Banana Ice is by far my favorite!!",,,
752,5.0,Love it,This item is portable and the flavors are extraordinary. Love it. Purchasing more.,,,
753,4.0,Good,Good flavor and draw,,,
754,5.0,Great vape,Last long time reduced craving for cigarettes,,,
755,5.0,Customer,The best customer service and the best prices just started a few weeks ago from this company I receive my purchase the next day and will only purchase from this company,,,
756,5.0,Great vapes,"Gummy teddy tastes like cereal milk and watermelon peach pear has a bad aftertaste, watermelon raspberry and strawberry banana are great. They last longer than any disposable vape I’ve tried",,,
757,5.0,Tasty,"Tastes just like watermelon gum, I love it",,,
758,5.0,Coke flavor,"Smell great with mint could make you stun 5 second, but I need more smoke than usual",,,
759,5.0,Good flavor.,Tastes pretty good. Ordered this one and the mighty mint. Both are great.,,,
760,5.0,Long lasting,Great taste and great customer service,,,
761,5.0,GREAT,excellent flavor,,,
762,5.0,Love,These are my favee. Adjustable flow,,,
763,5.0,Great!,As a cigarette smoker it's a nice alternative for me!,,,
764,5.0,Everything was superb,Love this product. The flavors are always so clean. Convenient to just throw away without having to recharge. Way better than the mess of refilling a tank with juice! And the shipping is super fast! Got my products the following day even on a holiday weekend,,,
765,5.0,Hyppe Max Flow,My favorite disposable. Highly recommend. Huff and Puffers makes purchasing these so easy!,,,
766,5.0,Great product but Lush Ice flavor....,"Lush smells awesome, but the taste..... It really depends on your taste if you like vaping something from bath and body works :)",,,
767,5.0,Delish,"Excellent flavor, long lasting, great price.",,,
768,5.0,Vape,Love the taste,,,
769,5.0,Amazing,Work great,,,
770,5.0,Great,"Fast shipping and product, so far so good!",,,
771,5.0,Love it,One of my favorites:) will be ordering again!,,,
772,4.0,It's ok!,I liked this one,,,
773,5.0,Smooth & Tasty,I buy the Hyppe Max Flow in Watermelon Peach Pear regularly. Its always tasty and never disappoints.,,,
774,5.0,Love it!,I am very happy with this vape pen.... Love the flavor!,,,
775,5.0,Great,Fast delivery,,,
776,5.0,Great Flavor!,My personal favorite of the HYPPE bars/flavors.,,,
777,5.0,Great price,Love it,,,
778,5.0,Great Product. Great Price,Last quite a long time and never has a burnt taste.,,,
779,5.0,Love the super quick delivery!!,Love this product and the flavor. I love it that they have such a variety to choose from! I won't be ordering from anyone else.,,,
780,5.0,The watermelon is amazing,The flavor was spot on,,,
781,5.0,"Daily Smoker, Ex-Cigarette Smoker",Best disposable vape with a true Mint flavor. Great for menthol cigarette smokers looking to quit. Worked for me. Great service here for the last 1.5 years.,,,
782,4.0,Arrived fast,I like it but wasn't aware of the minty or ice in it.,,,
783,5.0,Great!,"You guys are the best. Thank you so much. These are my favorite go-to e-cig. They are hard to find where I am and if you do find them, they are extremely over-priced. Thank you for all that you do.",,,
784,4.0,Good disposable,"Tried out this flavor for the first time and wasn’t a huge fan of it, but they last a lot longer than I thought they would!",,,
785,5.0,Best I’ve Tried,"I have been ordering for months and decided to go through another store and by far this is the best. The flavors Strawberry and Banana & Cool Mint are my favs. They don’t have a chemical taste to them at all. Ships fast too, I always get my shipment within 3 days of ordering.",,,
786,5.0,Best ones,These Maxflos have the best flavor and definitely last the longest. I’ve tried many brands but stuck with these.,,,
787,5.0,5 Stars,Paid extra for expedited shipping. 19 DAYS later I get an email saying they have been delivered. Please use ups instead of postal service!,,,
788,5.0,Good disposable vape pens,With the exception of shipping everything was exactly what I wanted. Holiday shipping sent my product in a million different directions and it took weeks to get to me. Not the company's fault.,,,
789,5.0,Great alternative for smoking!,"Great flavors, nice draw and long lasting. Our favorite vape!",,,
790,5.0,5 Stars,Right on time! Quick delivery.,,,
791,5.0,5 Stars,Hyppe Max Flow Disposable Vape 5% Nicotine,,,
792,4.0,Great Vape,"I love this product and our order was complete and correct. We only had an issue with one vape. One of the banana flavored hyppe, malfunctioned and did not work. Other than that they were all awesome.",,,
793,5.0,Favorite Disposable Vape,My favorite flavor! Love it!,,,
794,5.0,Hyppe Bar,Shipping was fast. It lasted pretty long pretty good flavor would buy again.,,,
795,2.0,2 was likings,Out of the 6 that I bought 2 of them was liking so it was trash,,,
796,5.0,Amazing service!,Great prices and even greater customer service. I’ll be placing another order shortly.,,,
797,5.0,Great Product,fast shipping and exactly what was described!,,,
798,5.0,5 Stars,"Good service, and fixed my damaged order with a new one",,,
799,3.0,3 Stars,2/3 of my products were leaking upon arrival.,,,
800,5.0,Hypee max flow,Works great awesome flavor,,,
801,2.0,2 of them didn’t work,Out of four purchased 2 worked. One of the ones that did work tasted burnt. I really love the product when it works but there is Definitely some Quality control issues on your end for sure.The owner of local vape shop by me reports the same quality control issues as well. Please fix this and you guys will go down in the history books as the best vape company ever to grace the earth!,,,
802,5.0,5 Stars,The guava ice tasted like rotten tomatoes and chemicals,,,
803,4.0,watermelon peach tear,"REALLY FAST SHIPPING! HIGHLY RECOMMEND! I'm taking a star out because lately the watermelon peach pear has been inconsistent. Someday it'll taste like watermelon peach pear, someday it has a creamy taste and I am not a huge fan for creamy taste but overall, this is my go-to spot to buy vape",,,
804,5.0,5 Stars,Fast shipping!,,,
805,1.0,Fake!!!,These are the fake Hyppe bars :( do not buy!!,,,
806,5.0,Good flow of flavor and smoke,I’d buy again,,,
807,5.0,5 Stars,Hyppe Max Flow Disposable Vape 5% Nicotine,,,
808,5.0,5 Stars,I have yet to receive it. I see on your site you processed and shipped quickly so I believe the hold up is with USPS,,,
809,5.0,In time and working,"Products worked, easy checkout, shipment arrived before expected.",,,
810,2.0,Tasted great,Work for a little while then flashed,,,
811,5.0,So good,I love these vapes and they ship so quickly! Highly recommend!,,,
812,5.0,5 Stars,Was good,,,
813,5.0,Happy Customer!,"These last and come in some great flavors. Guava Pineapple Orange, Lush Ice, Banana Ice and Strawberry Banana are my faves so far. Excellent customer service and super fast shipping. Thank you!",,,
814,4.0,4 Stars,Hyppe Max Flow Disposable Vape 5% Nicotine,,,
815,5.0,5 Stars,..,,,
816,5.0,Good product,Love Love Love these 🥰🥰,,,
817,5.0,Worth every penny!,These vapes are by far the best and worth the cost. You get your monies worth. These disposables last a good amount of time. 2000 puffs! Definitely will be buying more. Huff and Puffers is the best website. I've shopped all over but after finding this website I'm sticking with Huff and Puffers.,,,
818,5.0,"Love these, and amazing customer service!","These are definitely some of my favorite disposables, mainly because of the 2000 puffs. Although I have had 2 of them stop working. But their customer service is 10/10, so amazing and so helpful. Probably the best I have encountered in a while. Plus their shipping is so quick. This is the only place I will buy disposables now. I can't recommend them enough!",,,
819,5.0,5 Stars,Hyppe Max Flow Disposable Vape 5% Nicotine,,,
820,5.0,Extremely happy,Extremely fast shipping!! Products cost half the price vape shops sell them for. I’ve ordered multiple times never been disappointed.,,,
821,5.0,Happy customer!!,"Great products, even better prices, and quick shipping what more could you ask for. Chewy watermelon is bomb!!",,,
822,5.0,The Best,Great flavor love the air flow option,,,
823,5.0,Great Taste!,I couldn't be more pleased with this product and flavor varieties!,,,
824,5.0,5 Stars,Favorite kind,,,
825,5.0,Great service,"Loved the product, great service",,,
826,3.0,Love these so much,"I would have given it 5 stars but i ordered 2 last week and one of them came out defective and it was flickering on and off on its own, producing no smoke, and when i tried to hit it, it tasted and smelled like nail polish. I tried it the next day and it just flickers all day as if someone is hitting it. Wish i could get a new one.",,,
827,5.0,5 Stars,Great product. Fast shipping.,,,
828,5.0,Kt,Great product. One day my favorites. Cheaper ordering with your company than the smoke shop. $10 difference even with shipping.,,,
829,5.0,5 Stars,I will continue to order from you guys great product and fast shipping completely satisfied highly recommended,,,
830,5.0,5 Stars,Hyppe Max Flow Disposable Vape 5% Nicotine,,,
831,5.0,5 Stars,Fast shipping. Good product.,,,
832,5.0,5 Stars,Fast shipping!,,,
833,5.0,5 Stars,Love the flavor!,,,
834,5.0,5 Stars,Hyppe Max Flow Disposable Vape 5% Nicotine,,,
835,5.0,Love them!!,The best replacement for cigs by far for me!! There hasn’t been a flavor that I haven’t liked.,,,
836,5.0,Finally. It lasts longer than 2 days :),My new favorite. Great flavor & has consistent battery that LASTS. And I received it fast! Very happy,,,
837,5.0,awesome product,very flavorful and top brand,,,
838,5.0,awesome!,"this is my absolute favourite disposable brand thus far!! i’ve tried quite a few but hyppe is by far the smoothest, best tasting, and longest lasting vape in my opinion. i suggest the watermelon peach pear flavor",,,
839,3.0,3 Stars,Hyppe Max Flow Disposable Vape 5% Nicotine,,,
840,5.0,Enjoyed,I like this one a lot better than most,,,
841,4.0,Decent,the strawberry lemonade leaks but the mighty mint it good,,,
842,1.0,stopped working,"Stopped working after less then 10 pulls, like its clogged. Can kinda get a little out if i reeeally pull but not worth the effort 🤷‍♀️",,,
843,5.0,Fave Flavor,Super quick shipping! Awesome prices! The cheapest I have found. Very happy with this company :),,,
844,1.0,DID NOT WORK,"I got the hyppe max flow peach and ice, did not even work. So disappointed, will not order from this website again.",,,
845,5.0,Good product,satisfied,,,
