Review_id,Ratings,Heads,Texts,Flavor,Sweet,Lasting
486,5.0,Hype Max Flow Supreme Disposable,My flavor of choice is Lush Freeze. I LOVE it! Great price! Great product! Peter is FANTASTIC! This is one very happy customer!,,,
487,5.0,Great service.,Great customer service. Always having top shelf vapes available whenever I want.,,,
488,5.0,Strawberry sky aka strawberry gummy,"So far this is my all-time favorite. This particular brand seems to be the only one I have found that does not leave that nasty aftertaste, make me cough, or cause my chest to hurt. When I first started using the hyppe disposable, I bought them from my local Circle K and they lasted me almost two weeks. I was thrilled to find them for $7 less online from huff and puffers. I ordered from several different places online but this one has the best service and best price overall.
I must admit I probably use it more now that I do not smoke cigarettes at all, but now they only last two days. It's hard for me to imagine that I'm puffing THAT many more puffs then I was before. There are definitely not 2,000 puffs on any setting, because you would literally have to Puff every minute for every waking moment to use it in 2 days time. I use mine on the lowest flow possible and it gives a great hit and very full flavor. I was a pack a day smoker, so it's still cheaper than cigs. They have changed something in these, but they are still, hands down, the best on the market for me.",,,
489,5.0,Cucumber Berry,"This flavor was especially refreshing. This particular brand seems to be the only one I have found that does not leave that nasty aftertaste. My favorite is the strawberry sky or strawberry gummy but this is a nice refreshing change. When I first started using the hyppe disposable, they lasted me almost two weeks. I must admit I probably use it more now, but now they only last two days. It's hard for me to imagine that I'm puffing THAT many more puffs then I was before. Maybe they got a clue and reduced the amount in the vape but how will we ever know?",,,
490,5.0,Awesome!,Soo nice to be able to control air flow! Awesome!,,,
491,5.0,Must have!!,This is one of my flavor and puff that I really like it.,,,
492,5.0,Went back for some more Naked,"Was afraid they might run out of stock like the other store local to me did, so went back to stock up on some more. Forgot to mention in my previous review that their prices are good. They were lower than the local shop I normally went to and better or competitive with other online only shops.",,,
493,5.0,Naked the smoothest flavor I found so far,"Have had no issues with hits causing me to cough or harshness. Naked is not flavorless. It's mild/medium spearmint flavor ICED. Got brain freeze many times while using it.
So far I used 6-7 units. No defective units and I believe they all lasted about the same amount of time. Currently one unit lasts me about 3-5 days, but I'm still smoking and don't typically use them when I'm home.
Luckily this shop is local to me and I can drive over to purchase what I want. All the people who've helped me so far were nice. It's nice to be able to check their site to see what's in stock before driving over to make a purchase.",,,
494,5.0,Good Draw,"Good draw, convenient",,,
495,5.0,Banana freeze,Very good,,,
496,5.0,Love it Banana Breeze is # 1,ive tried different flavors this takes the win.,,,
497,4.0,Tasty,I give it two thumbs up,,,
498,3.0,I like,"They work great, tasty i would recommend but I go through these pretty quick.",,,
499,5.0,hyppe max flow,good product,,,
500,4.0,It was ok,👍🏻,,,
501,5.0,Must have,Taste all the notes of flavor with a smooth flow every puff,,,
502,5.0,Sweet orange,"Delicious vapor of sweet orange, smooth, lasts me 3 days on max flow",,,
503,5.0,Super flavor,"Awesome smooth lasting, my fav flavor of all hyppes",,,
504,5.0,Best vape shop around.!,"Wether it’s a quick stop for my usual disposal vapes or I’m shopping around for something different for a change, these guys are informative, always have good quality products and the best flavors.! It’s my go-to vape shop.! You won’t be disappointed.!",,,
505,5.0,My fav,My favorite disposable vape pen hands down!,,,
506,5.0,My fav,My favorite disposable vape pen hands down!,,,
507,5.0,My favorite,My favorite disposable vape pen hands down!,,,
508,5.0,The best,I’ve been ordering my vapes regularly from them. Easiest and most pleasant experience ever. They are super quick to get me my order and are quick to respond to any questions I have. When I put the wrong address on my order they were so quick to act on it and correct it for me after it was already on the way. Thank you guys and I am forever grateful and proud to be a customer!,,,
509,5.0,love it,always buy the same and i love it,,,
510,5.0,Awesome Flavor.,Great flavor combination definitely an all day vape. Will definitely be having this in my everyday rotation.,,,
511,4.0,Pretty Good,Flavor is light compared to some of other flavors ice had before but good enough.,,,
512,5.0,Great service,Great quality,,,
513,5.0,Good,Like this one,,,
514,5.0,Fave so far,Nice flavor,,,
515,5.0,Great glavor,Great service the product in excellent quality,,,
516,5.0,Good mint,Consistent vape,,,
517,5.0,Online ordering,Great service no complaints,,,
518,5.0,Satisfied,I am very satisfied with purchase.,,,
519,5.0,Good,Hypemax brand is great,,,
520,4.0,Good,Good flavor lasts long,,,
521,4.0,Good,Fast shipping,,,
522,5.0,Great flavor!!,Nice and smooth!!,,,
523,5.0,Easy breezy,Out of all the disposables. I enjoy their flavors the most.,,,
524,5.0,Disposable Vape,These are my favorite disposables.......the prices and shipping time are amazing. Will be purchasing again for sure!,,,
525,5.0,Best brand so far,smooth and easy flavors.,,,
526,5.0,smooth draw,so far this is the best brand for the price. flavors are not to overly sweet and the adjustable feature is nice to control the intake.,,,
527,5.0,Fire,Great products no duds,,,
528,5.0,Fire,Great products no duds,,,
529,5.0,Good vape,Good vape. Some run out of flavor but it's mostly been good,,,
530,5.0,Good vape,Good. Vape for orice,,,
531,5.0,Great,Great customer service too,,,
532,5.0,Convenient,"When your on the go and don’t have time for a smoke break, I smoke these in my car and it leaves no after smell",,,
533,4.0,Friendly,Easy to use good for disposable,,,
534,5.0,Lush Freeze best flavor!,"Sweet, icy, smooth, & one pen lasts me almost a week!",,,
535,5.0,one of the best disposable out there,great number puffs and great taste,,,
536,5.0,Smooth flow - nice flavor.,The supreme flow is pretty nice - super smooth. The grape flavor is good too. One of my favorites.,,,
537,4.0,Great flavor,Love it,,,
538,5.0,Mighty Mint,This company ships faster than anyone I know. I like the Mint the best. It's got a nice cool throat hit. Never had any issues with device at all.,,,
539,5.0,Very good !!!,"I like the product since day one, they’re much cheaper in this website than at the gas station where I used to buy them. Love the taste and delivery was fast too.",,,
540,5.0,Recommend,Like it,,,
541,5.0,Good one,Pretty nice,,,
542,5.0,So fresh,Favorite for my mom,,,
543,5.0,Top,Best,,,
544,5.0,My favorites,Out of all the different brands I have used this is my favorite. I recommend these especially the strawberry freeze,,,
545,5.0,good,good,,,
546,5.0,good product,yum,,,
547,5.0,It’s so good,I loved,,,
548,5.0,good,try it,,,
549,5.0,good stuff,good product,,,
550,5.0,good stuff,one of favs,,,
551,5.0,Smooth long lasting puff,Just enough flavor and hit to fulfill a single puff of satisfaction.,,,
552,5.0,Yum!,I like the PF!,,,
553,5.0,Best Disposables,"Always a trustworthy choice with many options. Lasts at least a few days (heavy smoker), great flavor choices, and rarely ever taste burnt towards the end!",,,
554,5.0,Excellent,I love being able to adjust the flow and get harder hits.,,,
555,5.0,My go to vape,Love this vape. All their flavors are amazing and not too strong. It hits thick and smooth,,,
556,5.0,Delicious,Treat yourself,,,
557,5.0,Really good,Most flavors are great,,,
558,5.0,I like it nice smooth,It’s a good product,,,
559,5.0,Hyppe Max flow,Love the unflavored or aka naked. Lasts a long time,,,
560,5.0,Fave flavor,This is my favorite flavor! Super smooth and minty sweet,,,
561,5.0,New flavor!,Hits nice!,,,
562,5.0,Vape pin,"Product worked great. Fast delivery. Exalent
service",,,
563,4.0,Good,I liked it,,,
564,5.0,Nice,Taste just like banana! Loved it!,,,
565,5.0,Best ones,Tried a bunch of others- won't get any other kind anymore.,,,
566,5.0,Best vape,"This is the best disposable vape pen I have come across. All the others either leak, are broken, or doesn't work properly. Highly recommend. Also, a lot of flavors.",,,
567,5.0,These are my favorite,"Good price on these Max Flow vapes, which are my favorite. I really loved that they came next day!",,,
568,5.0,Hyppe is my go 2..,Quit cigs n May. Started off w Hyppe and continued. The shipping w Huff n Puff is TWO DAYS..AWESOME..THANKS GUYS,,,
569,5.0,Good,lasts for days and is easy to use. also great pricing,,,
570,5.0,Easy Transition from Cigs,"I started vaping to get off a 50 year cigarette addiction. I found the Max Flow Naked came closest to a cigarette experience. Then I discovered the Cotton Clouds Max Flow which has become my favorite. It's a cleaner smoke than cigs. I don't cough any more, nor do I get congested. Plus, no ashes, no butts, no ashtrays. Plus, it doesn't smell up the house. Love the Max Flow.",,,
571,5.0,Love this vape,Cheap and easy to use. Only bad thing it only lasts 2 days. Besides solid product.,,,
572,5.0,Replacement,Very nice introduce by my son on a golfing day. Bought one and it was defective and huff and puff replaced it!,,,
573,5.0,Great product,Great Flavor,,,
574,5.0,Excellent Flavor,This is the best minty vape flavor!,,,
575,5.0,Good Brand,I like the freeze flavor,,,
576,5.0,Great,Great,,,
577,1.0,Not great,Not great,,,
578,5.0,Best customer service I've had in the pandemic,"Ok, the vapes almost all were amazing. I reached out however about a couple that were just not ""hitting"" like the others. They emailed me back within a couple hours saying they would send replacement pods asap. True to their word they were shipped within 24 hours and worked phenomenally. I highly appreciate the people at the company and it shows that dealing with mom and pop shops truly pays off.",,,
579,5.0,Great product,"Love the variety to choose from. Lasts a long time and is very compact, not bulky at all. Love Cola Ice & Chewy Watermelon",,,
580,5.0,Most helpful staff!,A great experience all around - and the most helpful staff I've ever experienced,,,
581,5.0,Great,Would buy again,,,
582,5.0,Favorite flavor,Great flavor with refreshing mint with every hit,,,
583,5.0,(:,These are super smooth and the flavors are delicious!,,,
584,5.0,Good store with good price,Compared to other store Huff and Puffers giving you a steal deal. I only pay $18 for Hyppe max flow while other store I bought was $28. Highly recommend this store,,,
585,5.0,Love it,Love the vape with great choice of flavors,,,
586,5.0,Hyppe is the best,Actually I’m very happy buying the Hyppe vapes all the flavors are so good 😊,,,
587,4.0,Good Device,Lasts a good amount of time. I got the lush flavor and didn’t really like it much but it has good airflow and gets the job done.,,,
588,5.0,One of my favorites,This taste like Bang which I love!,,,
589,4.0,convenient,"this disposables will give you what you are looking for, good flavor and a great vaping felling. the batterie life doesn't last too much but it get the job done, just make sure you get the supreme version. I will recommend you to get the smoke acro you gonna save money !",,,
590,5.0,Hyppe Vape Disposable Pen,It is slim and light weight . Nice soft feel to it . Easy fit in pockets and purses. A lot of tasty flavors to choose from. Tried many other brands and this is my favorite.,,,
591,5.0,Good vape,The flavor and the smoke,,,
592,5.0,Great product from a great shop,"The cola flavor i got is really good, it tastes just like Coca Cola.",,,
593,5.0,Yum yum,"Long lasting, great brand! I love the cola ice flavor, taste like a real refreshing coke, it satisfies my sweet teeth craving.",,,
594,5.0,Fantastic,Flavor was good and smoked at your own level of air.,,,
595,4.0,Good,Would buy again,,,
596,4.0,Good,Would buy again,,,
597,4.0,Good,Would buy again,,,
598,4.0,Pretty good,Smooth,,,
599,4.0,Good flavor,Doesn’t seem to last as long as smaller devices . Battery ran out before flavor. But good while it lasted,,,
600,5.0,Best disposable I have found,"Best disposable vape I have found thus far. Finally help me quit cigarettes. Tried it all blu, juel, puff none of them were enough to make me quit. But the hype supreme finally did it!",,,
601,5.0,My new to go to flavor,Love this flavor,,,
602,5.0,Hype pen,Great smooth hit excellent product,,,
603,5.0,These are awesome!,I love these they are legit. The flavors are soo good and they are at a decent price.,,,
604,5.0,Smooth and great flavor,The pull was nice and smooth and the flavor was great!,,,
605,5.0,Tastes great and lasts,This product is great the taste is always consistent and it lasts fairly long depending on how often and individual smokes.,,,
606,4.0,😁,👍,,,
607,5.0,I like the taste,I don’t smoke as much and My clothes don’t have that horrible smell of smoke.,,,
608,4.0,Great Flavor,Hits are perfect with great flavor. Just wished they lasted longer. Aloe grape and lush ice are the best.,,,
609,5.0,Hyppe,Works great,,,
610,5.0,Hype,Hype max flow are good,,,
611,5.0,Smooth and lasting,I like the cola one. Smooth and lasting flavor.,,,
612,5.0,Quality,Quality,,,
613,5.0,Great lifespan and flavor,I've found that this brand really holds up to the 2500 (around there I believe?) puffs and lasts me quite a while. Cucumber berry is also my favorite flavor so I would definitely back this flavor in addition to the brand and its lifespan,,,
614,5.0,Hyppe,Surprised with the great flavor very bold would buy again,,,
615,5.0,Lasts for a while,Great flavor and lasts about a week,,,
616,5.0,I like how I could adjust the drag,Great being able to adjust the flow,,,
617,5.0,Great,Great flavor,,,
618,5.0,I like the flavor,I like the flavor and how it is disposable,,,
619,5.0,Hyppe supreme max,Excellent product I love this brand,,,
620,5.0,Review,Love this flavor 😋,,,
621,5.0,Max flow fiyaa :),Its fiyaaaaaa :),,,
622,5.0,Review,A must buy !!,,,
623,5.0,Vaping rewards,Favorite brand of vaping,,,
624,5.0,Max flow fiyaa :),My favorite go to for vaping!,,,
625,5.0,Great Service & Quick Delivery. Exactly what I was looking for!,"I liked everything about this whole process. Great price, easy to purchase, quick delivery, and got exactly what I ordered!",,,
626,4.0,Hyppe,Good flavor,,,
627,5.0,I love it,My favorite flavor,,,
628,5.0,Great taste,Good flow and flavor,,,
629,5.0,Killer price on a good vape,"Smooth, great flavor, lasts as long as expected",,,
630,5.0,Love it!,Finally found a flavor that I love and has a smooth taste and the flow is amazing.,,,
631,3.0,Nice clouds,These vapes produce pretty good clouds. Mint is lacking in flavor and is a bit dull,,,
632,5.0,Exactly what I ordered and delivered quick,"These were exactly what I ordered, because I couldn’t find them anymore at our local stores. They were delivered quickly. So happy I found them!!",,,
633,5.0,Love my Hyppe Maxflow,Love the Hyppe Maxflow peach! Great product and service.,,,
634,5.0,Great product,Has a good flow and smooth taste. Definitely my fav of them all,,,
635,5.0,"Nice flavor, sweet icey",Love being able to adjust the flow!,,,
636,5.0,Great Taste,This brand always has great flavors.,,,
637,5.0,Amazing,"All of the flavors are great, I’ve had one or two duds but the store is great with exchanging them. Appreciate the selection and the prices!",,,
638,5.0,My all time Fav,"Obsessed with the Gummy Teddy, it’s my favorite but definitely depends on what flavor you like. Long lasting and hits great.",,,
639,5.0,Excellent,My experience with my online purchase was great! Shipping was super fast. Definitely purchasing again,,,
640,4.0,Good Flavors,I ordered from HP because my original order from another company was totally messed up. Anyway I like the variety of flavors offered. The Lush Ice was great!! I got my order w/in 2 days. Loved it. Will order again from them.,,,
641,5.0,Great Value,"Quality products, speedy shipping.",,,
642,5.0,Love this product,I love this product helped me quit smoking cigarettes.,,,
643,5.0,Great price,I used to buy these at my local tobacco shop at $20 plus tax each. I get them on Huff and Puffers for $16 each after tax. Definitely buying here from now on!!,,,
644,4.0,Very good,Everything went well.,,,
645,5.0,Great Price,Excellent service and quick shipping,,,
646,5.0,Great pricing!,"This is my favorite product and their pricing is about $5 less than where I normally purchase. Quick shipping, too!",,,
647,5.0,Good disposable,These are so convenient,,,
648,5.0,Love these,These are great,,,
649,5.0,Great,These are my go to!,,,
650,5.0,Awesome,These are my favorite disposables!,,,
651,5.0,Yum!,These are so tasty!,,,
652,5.0,Satisfied,I really like the Hype Max Flow. I would definitely recommend this.,,,
653,5.0,Great,Great,,,
654,5.0,Tastes great,I have purchased many flavors which all I enjoy. The prices are great as well and will keep ordering from them as I have many more flavors to try. Definitely suggest ordering from them as you will save lots of money and they deliver fast.,,,
655,5.0,Awesome!!,Tastes great and lasts for sure!!!!,,,
656,5.0,Great taste,I love these vapes,,,
657,5.0,Great,Awesome,,,
658,5.0,Will buy over & over !!,"This company once again exceeded my expectations. I ordered my vapes & it took literally from start to finish only 3 days ( they came from West coast to East coast ) will def be ordering again & again. Btw, the vape hits smooth & I love the fact you can use either flavor or both at the same time. Enjoy !!!",,,
659,5.0,Satisfied,It’s a great product and I love the flavor. Also received my order within 2 days which is awesome,,,
660,5.0,favorite disposable,"flavor lasts, hits last",,,
661,5.0,solid,"classic disposable, airflow feature is n ice",,,
662,5.0,great airflow,"really like the adjustable airflow, flavor lasted a long time",,,
663,5.0,Excellent,Lasts long and smooth,,,
664,5.0,Amazing,This a great purchase flavor is good and last long,,,
665,4.0,Yummy,This flavor is really good last long too,,,
666,5.0,Smooth,Great last long good flavor smooth,,,
667,5.0,Best of all ecigarettes,Easy peasy smoking,,,
668,5.0,Great choice,My favorite is Banana Freeze,,,
669,5.0,Great experience,Very satisfied. Fast delivery and great products.,,,
670,5.0,Yum,Good flavor,,,
671,5.0,Great company,Will order again,,,
672,5.0,Awesome!,Amazing flavor and always quick shipping!,,,
673,5.0,LOVE IT,Great flavor. Lasts a long time!!,,,
674,5.0,Hype maxx,Great flavor,,,
675,5.0,Great,great,,,
676,4.0,hyppe max,got my order was easy and got here fast ship,,,
677,5.0,Great service and prompt delivery,Great service and prompt delivery,,,
678,5.0,Blue Gummy super yummy,Totally smooth and creamy after taste. Really enjoyed the Hyppe disposable Blue Gummy.,,,
679,5.0,One of my favorite flavors,I started vaping and was obsessed with the Hyppe disposables. Still vape with them sometimes. This (Red Apple Guava) and Gummy Teddy were my favorite flavors.,,,
680,5.0,Best flavor yet,Such a yummy mix!!,,,
681,5.0,Hyppe,"HANDS DOWN, my favorite vape brand! I love the lush and mint, it hits really good each time and the flavor is on point!",,,
682,5.0,great,n/a,,,
683,5.0,Great,Super fast delivery and products worked fine,,,
684,5.0,decent flavor,good brand that produces tasty flavors,,,
685,5.0,Great flow,Flavor was good,,,
686,5.0,Satisfied,Loved the flavors,,,
687,5.0,Hyppe Max Flow Disposable Vape 5% Nicotine,I think it’s a great product. It’s smooth and The flavors are not harsh like other vapes I’ve used in the past. I also love the variety of flavors. Hope to see the Hyppe Max Flow DUO on huff and puffers soon. This is a great product!,,,
688,5.0,Great product,"I never liked vaping before I was introduced to this product. I tried a few flavors but strawberry gummy is my favorite. It’s smooth, smells good, not strong. Shipping to my residence is 3 days and comes packaged nicely. Great product.",,,
689,5.0,Fast shipping great product,Happy with purchase thank you,,,
690,5.0,Great flavor,"I normally don't like banana, but this is really good.",,,
691,5.0,Loved it,Girlfriend wanted to try a new flavor and she loved it,,,
692,5.0,Great product,Best disposable e-cigarettes,,,
693,5.0,Excellent Product,I love the flavour and it lasts a bonkers amount of time.,,,
694,5.0,Good product,Good product,,,
695,5.0,Will be ordering again,First time ordering from here Delivery was fast.,,,
696,5.0,"yummy, long lasting",I love hyppe's superior flavors,,,
697,5.0,Best vape,I've ordered many brands of disposable vapes. Like to have a variety and options. I ordered the raspberry watermelon flavor and was pretty satisfied. The flavor was pretty good and the vape lasted longer than other vapes I have ordered in the past.,,,
698,5.0,Wonderful product and fast shipping.,Wonderful taste; a really smooth hit and just great flavor.,,,
699,5.0,THE best!,"Honestly scared to leave this review as I don’t want these selling out. The payment process is easy, good pricing, and they ship quick!",,,
700,5.0,Love it!,Absolutely love this!!,,,
701,4.0,Good,Long lasting,,,
702,4.0,Good Product. Long Wait for Delivery,Everything showed up just as I ordered and well packaged. Took over a week coming from California to California.,,,
703,5.0,Hyppe strawberry watermelon apple,Strawberry watermelon apple hyppe disposable vape is the best I’ve ever had. Great product. I wish they had this exact flavor in liquid.,,,
704,4.0,Ok,"Ok, flavor not as great",,,
705,5.0,Great Vape,"I like that I get more than 2 days out of these, and the price compared to buying these locally.",,,
706,5.0,Best disposable yet!,"I absolutely love these and almost every flavor I’ve tried. Of course there are different flavors that will appeal to anyone. I love all of the tropical flavors. The fact that you can control your puff strength is genius. I’m a previous smoker of almost 15yrs and thought I’d never be able to quit successfully. These have been life changing. Obviously smoking nothing would be ideal, but I’m not even close to that yet. I don’t stink anymore lol, they’re cheaper than cigarettes now, and taste a hell of a lot better. Personally this brand and type actually resemble the effect of smoking as far as the drag strength and “rush” go, although I am smoking way less than I ever smoked cigs. These are hands down the best disposable I’ve tried, I will continue to buy these! Not to mention the shipping is super quick, so definite added bonus :)",,,
707,5.0,Watermelon Ice is the best!,"I almost don’t want to write this for fear of it selling out, but one of my absolute favorite!",,,
708,5.0,Lush Freeze!,"I switch between XTRA Lush /Lush Fusion and this. By far my two favorite flavors, and I’ve literally tried at least 40-50! And as always H&P is my go to for vape products!",,,
709,4.0,Nice,Great flavor,,,
710,5.0,BEST FLAvOR EVER!,This was the first vape I ever tried l love it so much I order more than one every time! All of my friends love this one too. Also this site has super fast delivery.I am down to one cigarette a night most of the time Also love Banana ice that my friend let me try: Getting my own son😜,,,
711,5.0,Worth the money,A lot cheaper then in store and flavor is great,,,
712,5.0,Love it,Awesome will keep buying,,,
713,5.0,Great product,Great-tasting vapor or something that is easy-to-use. Perfect alternative to replace smoking cigarettes.,,,
714,5.0,No Complaints,"Good Price, Fast Delivery, Quick and easy. Love it!",,,
715,5.0,Fantastic,Love these. I quit smoking cigarettes using these vape pens entirely!!!,,,
716,5.0,Disposable vape,"Great product...I wouldn't have been able to quit cigarettes without these!!
Great service and product arrives quickly and packaging is excellent!😊",,,
717,5.0,Just what I wanted,Really like the adjustment that can be made on the bottom. Great hit and great flavor.,,,
718,5.0,10/10,10/10,,,
719,5.0,10/10,Great,,,
720,5.0,Amazing,Would recommend,,,
721,5.0,Excellent,Always what I want and fast shipping,,,
722,5.0,Nice flavor,easy to carry around and last a long time,,,
723,4.0,Very pleasant experience,I like the adjustable flow settings on the bottom.,,,
724,5.0,Hyppe max flow,"I love this product, I've tried others but to me this one is the best. This company is also #1, I use to order from a different seller and my package almost always was either lost or received it 4 weeks late. This is the best company by far!!",,,
725,5.0,Enjoying the flavors,Love the variety of flavors.,,,
726,5.0,Excellent Vape,HYPPE MAX FLOW is the best disposable vape by far!,,,
727,5.0,Favorite,One of the best flavors!,,,
728,5.0,I like it!,Switch over from puff xtra. Last longer for sure and i like how you can adjust the air flow.,,,
729,5.0,Great flavor,Lush is one of the best flavor for this pod. Would recommend,,,
730,5.0,nice product,I have ordered these before from another company and they were NOT the real thing and could not get my money back.,,,
731,5.0,Best disposable vape I’ve found,The flavor of this one is awesome and with the adjustable air flow can get the perfect puff,,,
732,5.0,Love it,Lasts a long time and great flavor.,,,
733,5.0,Satisfied Customer,Delivery was fast and accurate. Product worked well plan on placing another order.,,,
